Date,Title,Link,Source,source
2023-02-15 17:06:00,"TSMC out of favor with slew of funds alongside Berkshire, filings show",https://finance.yahoo.com/news/tsmc-favor-slew-funds-alongside-220602810.html,finance.yahoo,
2023-02-15 16:43:00,"Charlie Munger downplays risk of Taiwan invasion, says crypto fans are 'idiots'",https://finance.yahoo.com/news/charlie-munger-downplays-risk-taiwan-214346663.html,finance.yahoo,
2023-02-15 16:15:00,"These Stocks Are Moving the Most Today: Trade Desk, Upstart, Roblox, Airbnb, Devon, and More",https://finance.yahoo.com/m/b6edee1e-f764-389f-a6ca-500b648f0aa2/these-stocks-are-moving-the.html,finance.yahoo,
2023-02-15 13:49:00,US STOCKS-Wall mixed as retail sales point to more rate hikes,https://finance.yahoo.com/news/us-stocks-wall-mixed-retail-184941441.html,finance.yahoo,
2023-02-15 11:43:00,Berkshire Sale Sends Taiwan Semiconductor Stock Tumbling,https://finance.yahoo.com/m/b53b2778-bc27-3dce-b309-e7b720c56b2c/berkshire-sale-sends-taiwan.html,finance.yahoo,
2023-02-15 11:23:00,"Warren Buffetts Berkshire slashes TSMC holding, continues to build Apple stake",https://finance.yahoo.com/news/warren-buffetts-berkshire-slashes-tsmc-holding-continues-to-build-apple-stake-162244763.html,finance.yahoo,
2023-02-15 11:16:00,Warren Buffetts Taiwan Semiconductor sale shakes semiconductor stocks,https://finance.yahoo.com/video/warren-buffett-taiwan-semiconductor-sale-161616849.html,finance.yahoo,
2023-02-15 10:31:00,Nvidia Can Benefit Dramatically From This Big Tech AI Battle -- but Is It All Hype?,https://finance.yahoo.com/m/163d43fc-0c54-387f-9d7f-829dd7d3dc9b/nvidia-can-benefit.html,finance.yahoo,
2023-02-15 10:27:00,Why Taiwan Semiconductor Stock Is Down Today,https://finance.yahoo.com/m/b6e848f3-fe23-34f8-840e-2b8b0ab7ee60/why-taiwan-semiconductor.html,finance.yahoo,
2023-02-15 09:46:00,Taiwan Semiconductor stock slides premarket after Warren Buffett slashes holding,https://finance.yahoo.com/video/taiwan-semiconductor-stock-slides-premarket-144650666.html,finance.yahoo,
2023-02-15 08:18:00,"Midday movers: Roblox, Airbnb, Taiwan Semiconductor and more",https://finance.yahoo.com/news/midday-movers-roblox-airbnb-taiwan-131815823.html,finance.yahoo,
2023-02-15 07:29:00,TSMC: Bearish Hathaways getaway puts crack in the mirror trade,https://finance.yahoo.com/m/fe24cb58-8fc7-353e-9cfe-fbf2dbae0938/tsmc%3A-bearish-hathaway%E2%80%99s.html,finance.yahoo,
2023-02-15 07:29:00,Hedge Funds Piled Into TSMC Shares Last Quarter as Buffett Sold,https://finance.yahoo.com/news/hedge-funds-piled-tsmc-shares-122910404.html,finance.yahoo,
2023-02-15 05:37:00,Taiwan Semiconductor shares drop after Buffett reveals stake sale,https://finance.yahoo.com/m/e74b06cb-16a6-33ae-b1fe-daf6a69bea60/taiwan-semiconductor-shares.html,finance.yahoo,
2023-02-15 04:42:00,Berkshire Hathaway Sheds Most of Its Stake in Chip Maker TSMC,https://finance.yahoo.com/m/c65a0d38-35f9-3baa-93d5-4d127042e696/berkshire-hathaway-sheds-most.html,finance.yahoo,
2023-02-15 04:28:00,"Warren Buffett's ""buy and hold"" rule doesn't seem to apply to tech stocks",https://finance.yahoo.com/news/warren-buffetts-buy-hold-rule-092800591.html,finance.yahoo,
2023-02-14 22:20:00,Buffetts Quick $3.7 Billion Sale of TSMC Stock Spooks Investors,https://finance.yahoo.com/news/tsmc-shares-decline-buffett-berkshire-012514146.html,finance.yahoo,
2023-02-14 20:25:00,TSMC Shares Decline After Buffetts Berkshire Slashes Holdings,https://finance.yahoo.com/news/tsmc-shares-decline-buffett-berkshire-012514769.html,finance.yahoo,
2023-02-14 20:08:00,Warren Buffett Didn't Buy a Single New Stock to End 2022. But He Cut From 8.,https://finance.yahoo.com/m/58a99cd2-193b-3551-99da-db7e323e9f14/warren-buffett-didn%27t-buy-a.html,finance.yahoo,
2023-02-14 17:55:00,"Berkshire Hathaway Boosts Stake in Apple, Paramount Global in Relatively Quiet Quarter",https://finance.yahoo.com/m/b19d570c-2c1f-36f4-b224-bc8ba099ca87/berkshire-hathaway-boosts.html,finance.yahoo,
2023-02-14 10:23:00,Better Semiconductor Stock: Micron vs. TSMC,https://finance.yahoo.com/m/8fca39e1-80b9-37d6-8226-6c04646ad6bf/better-semiconductor-stock%3A.html,finance.yahoo,
2023-02-14 06:34:00,TSMC approves capital injection of $3.5 billion for Arizona factory,https://finance.yahoo.com/news/tsmc-boost-capital-arizona-factory-113401925.html,finance.yahoo,
2023-02-14 05:00:00,Warren Buffett's Berkshire Hathaway Set to Disclose Stock Holdings After the Close,https://finance.yahoo.com/m/e984a8db-494c-315b-9927-47873a9fe9aa/warren-buffett%27s-berkshire.html,finance.yahoo,
2023-02-13 09:43:00,Diversified Stock Portfolio: Sector ETFs and International ETFs to Buy,https://finance.yahoo.com/news/diversified-stock-portfolio-sector-etfs-144304912.html,finance.yahoo,
2023-02-11 08:29:00,Super Bowl LVII: How Arizona wins from hosting the big game,https://finance.yahoo.com/news/super-bowl-lvii-how-arizona-wins-from-hosting-the-big-game-132949168.html,finance.yahoo,
2023-02-10 14:10:00,13 Most Profitable Large Cap Stocks to Buy,https://finance.yahoo.com/news/13-most-profitable-large-cap-191337776.html,finance.yahoo,
2023-02-09 19:30:00,Tokyo Electron Raises Outlook on Stronger-Than-Feared Demand,https://finance.yahoo.com/news/tokyo-electron-hikes-outlook-despite-064726408.html,finance.yahoo,
2023-02-09 12:39:00,Why Taiwan Semiconductor Manufacturing Is Rising Today,https://finance.yahoo.com/m/2e8e2578-6743-3d69-be7d-ad8b7467c533/why-taiwan-semiconductor.html,finance.yahoo,
2023-02-09 07:05:00,Technical Assessment: Bullish in the Intermediate-Term,https://finance.yahoo.com/m/bb5b54ed-bfff-37b7-9ce9-5d3d6a3510bc/technical-assessment%3A-bullish.html,finance.yahoo,
2023-02-09 05:05:00,2 Top Bargain Stocks Ready for a Bull Run,https://finance.yahoo.com/m/598f65d5-314e-32af-9cfb-45681cec6434/2-top-bargain-stocks-ready.html,finance.yahoo,
2023-02-08 18:35:00,The 7 Best Beaten-Down Warren Buffett Stocks to Buy,https://finance.yahoo.com/news/7-best-beaten-down-warren-233553685.html,finance.yahoo,
2023-02-07 09:00:00,Taiwan Semiconductor Manufacturing Company Ltd. (TSM) is Attracting Investor Attention: Here is What You Should Know,https://finance.yahoo.com/news/taiwan-semiconductor-manufacturing-company-ltd-140002287.html,finance.yahoo,
2023-02-07 06:11:00,Is Texas Instruments Stock a Better Buy Than Taiwan Semiconductor Manufacturing?,https://finance.yahoo.com/m/d838a7d7-e169-3c64-9473-7f3b4378f118/is-texas-instruments-stock-a.html,finance.yahoo,
2023-02-06 14:22:00,Why Many Semiconductor Stocks Jumped in January,https://finance.yahoo.com/m/92b9cc43-eeda-3c74-9610-f9240a137eb5/why-many-semiconductor-stocks.html,finance.yahoo,
2023-02-06 11:14:00,Why Taiwan Semiconductor Manufacturing Is Falling Today,https://finance.yahoo.com/m/75d7b7c1-034a-3bb6-a336-792712a3e94c/why-taiwan-semiconductor.html,finance.yahoo,
2023-02-06 11:06:00,"Two Intel rivals positioned to dominate the chip industry, report says",https://finance.yahoo.com/m/d73f4f88-d8fb-3b47-9d6c-6324ae89c302/two-intel-rivals-positioned.html,finance.yahoo,
2023-02-06 07:38:00,Weekly Stock List,https://finance.yahoo.com/m/2eb83864-e818-38e2-83e0-dec31d11af28/weekly-stock-list.html,finance.yahoo,
2023-02-05 18:54:00,Taiwans Dollar Is Latest Emerging-Market Domino Lined Up to Wobble,https://finance.yahoo.com/news/taiwan-dollar-latest-emerging-market-235443531.html,finance.yahoo,
2023-02-05 08:01:00,"Third-Largest U.S. Pension Sells Alibaba, TSMC, and MGM Stock. It Bought Harley-Davidson.",https://finance.yahoo.com/m/3fdadf6e-282d-3f7b-9543-519b8239afc4/third-largest-u.s.-pension.html,finance.yahoo,
2023-02-04 08:01:00,Buffett Stock Portfolio: Warren Buffetts Recent Buys,https://finance.yahoo.com/news/buffett-stock-portfolio-warren-buffett-130109442.html,finance.yahoo,
2023-02-03 09:21:00,2 Dividend-Paying Tech Stocks to Buy in February,https://finance.yahoo.com/m/c272c6a8-8afc-3ff6-88cb-da261519db17/2-dividend-paying-tech-stocks.html,finance.yahoo,
2023-02-03 08:54:00,The 3 Most Promising Quantum Computing Stocks to Buy in February,https://finance.yahoo.com/news/3-most-promising-quantum-computing-135405218.html,finance.yahoo,
2023-02-03 07:00:00,"The Best Stocks to Invest $1,000 in Right Now",https://finance.yahoo.com/m/dd0e6dec-25a9-3002-bcd2-48934d1ff365/the-best-stocks-to-invest.html,finance.yahoo,
2023-02-02 22:51:00,Brutal Earnings From Intel Signal Changing of Guard in Chips,https://finance.yahoo.com/news/brutal-earnings-intel-signal-changing-035135468.html,finance.yahoo,
2023-02-02 10:48:00,10 Hot EV Stocks To Buy Now,https://finance.yahoo.com/news/10-hot-ev-stocks-buy-154821424.html,finance.yahoo,
2023-02-02 09:50:00,1 Hot Nasdaq Stock Warren Buffett Should Buy in 2023,https://finance.yahoo.com/m/10e68ac8-fc66-327a-980b-63b5300ac6c9/1-hot-nasdaq-stock-warren.html,finance.yahoo,
2023-02-02 07:54:00,"Got $1,000? 3 Cheap Stocks To Buy Right Now",https://finance.yahoo.com/m/9eb273b7-99e0-3f38-a5c3-f9805a0228e1/got-%241%2C000%3F-3-cheap-stocks-to.html,finance.yahoo,
2023-02-01 05:15:00,3 Things About Texas Instruments That Smart Investors Know,https://finance.yahoo.com/m/5637111f-40dc-3826-af26-14747dc0d6ad/3-things-about-texas.html,finance.yahoo,
2023-01-31 10:37:00,Where Will Intel Stock Be In 1 Year?,https://finance.yahoo.com/m/d38b1e1b-f87d-3cae-9c66-1edccc52d0ce/where-will-intel-stock-be-in.html,finance.yahoo,
2023-01-31 06:10:00,Is ASML Holding Stock a Buy Now?,https://finance.yahoo.com/m/4715c29b-e6ba-3034-b7b3-4196cafafd48/is-asml-holding-stock-a-buy.html,finance.yahoo,
2023-01-30 08:45:00,1 Unusual Warren Buffett Growth Stock Down 34% to Buy in 2023,https://finance.yahoo.com/m/d627b6d2-288c-39b0-896d-1a8ef141f219/1-unusual-warren-buffett.html,finance.yahoo,
2023-01-29 15:19:00,3 Tech Stocks That Will Be Big Winners in 2023,https://finance.yahoo.com/news/3-tech-stocks-big-winners-201949694.html,finance.yahoo,
2023-01-29 07:19:00,"Taiwan Semiconductor Manufacturing Is Off to a Hot Start in 2023, but Is It Too Early to Celebrate?",https://finance.yahoo.com/m/86fd8512-c654-368a-bacb-8c6d3abd968b/taiwan-semiconductor.html,finance.yahoo,
2023-01-28 14:16:00,12 Cash-Rich Dividend Stocks to Buy Now,https://finance.yahoo.com/news/12-cash-rich-dividend-stocks-191615056.html,finance.yahoo,
2023-01-27 17:43:00,Like Income? These 3 Chip Stocks Pay Dividends,https://finance.yahoo.com/news/income-3-chip-stocks-pay-224310494.html,finance.yahoo,
2023-01-27 09:27:00,"Intel stock plunges on weak guidance, AMD and TSM stocks gain momentum",https://finance.yahoo.com/video/intel-stock-plunges-weak-guidance-142747089.html,finance.yahoo,
2023-01-27 09:00:00,Taiwan Semiconductor Manufacturing Company Ltd. (TSM) Is a Trending Stock: Facts to Know Before Betting on It,https://finance.yahoo.com/news/taiwan-semiconductor-manufacturing-company-ltd-140002951.html,finance.yahoo,
2023-01-27 06:10:00,"Got $1,000? 5 Buffett Stocks to Buy in 2023 and Hold Forever",https://finance.yahoo.com/m/6853e744-9a29-3bec-969c-e918ba26c307/got-%241%2C000%3F-5-buffett-stocks.html,finance.yahoo,
2023-01-27 04:35:00,Chip glut batters semiconductor industry as Intel shares lose almost all their 2023 gains after dismal earnings,https://finance.yahoo.com/news/chip-glut-batters-semiconductor-industry-093559761.html,finance.yahoo,
2023-01-26 05:05:00,"These Warren Buffett Stocks Are Crushing the Market in 2023, and They Aren't Done Yet",https://finance.yahoo.com/m/793ed701-cd26-3a56-80ed-a3f78709b3c0/these-warren-buffett-stocks.html,finance.yahoo,
2023-01-25 09:45:00,"2 Tech Stocks With Upside Potential in 2023, According to Wall Street",https://finance.yahoo.com/m/3c785683-3ba2-3749-9530-b6269d314915/2-tech-stocks-with-upside.html,finance.yahoo,
2023-01-25 08:00:00,Is Taiwan Semiconductor a Top Warren Buffett Stock to Buy for 2023?,https://finance.yahoo.com/m/27eb2784-16d0-37db-a2d5-9d9175499048/is-taiwan-semiconductor-a-top.html,finance.yahoo,
2023-01-25 07:08:00,Intel stocks dividend sticks out among chip makers. But a cut may be coming.,https://finance.yahoo.com/m/6dbe47ec-2e30-3409-9778-cfb49dc20379/intel-stock%E2%80%99s-dividend-sticks.html,finance.yahoo,
2023-01-24 16:34:00,SEMICON West semiconductor conference moving to Phoenix from San Francisco,https://finance.yahoo.com/m/7d7056fc-5969-326c-9c9d-52d3db6aadea/semicon-west-semiconductor.html,finance.yahoo,
2023-01-24 10:30:00,Is Taiwan Semiconductor Manufacturing a Buy?,https://finance.yahoo.com/m/bf3a0228-84e8-34de-92be-eb6d1f7a4710/is-taiwan-semiconductor.html,finance.yahoo,
2023-01-23 12:52:00,Why Taiwan Semiconductor Manufacturing Rallied Today,https://finance.yahoo.com/m/be841196-b385-3f72-89b8-bd6a92a2162d/why-taiwan-semiconductor.html,finance.yahoo,
2023-01-23 09:15:00,"Got $5,000? Buy and Hold These 3 Value Stocks for Years",https://finance.yahoo.com/m/55b0eb95-db51-3c1e-ac5e-14572f709087/got-%245%2C000%3F-buy-and-hold.html,finance.yahoo,
2023-01-23 06:00:00,ChatGPT Takes the Tech World by Storm: 4 Stocks Poised to Benefit (Besides Microsoft),https://finance.yahoo.com/m/a6eb1c75-281c-3fc1-b626-0109e8dfcee5/chatgpt-takes-the-tech-world.html,finance.yahoo,
2023-01-22 10:00:00,10 Most Advanced Battery Technologies That Will Power the Future,https://finance.yahoo.com/news/10-most-advanced-battery-technologies-150057439.html,finance.yahoo,
2023-01-22 08:20:00,"The Chip Industry Is in Flux in 2023, and TSMC Is on Sale",https://finance.yahoo.com/m/e4edf658-5dfc-3c4c-a35f-3be8604b3bc8/the-chip-industry-is-in-flux.html,finance.yahoo,
2023-01-22 07:40:00,Taiwan Semiconductor Could Soar in 2023,https://finance.yahoo.com/m/cb7303d7-74ae-3e70-b0e4-1af1080daea9/taiwan-semiconductor-could.html,finance.yahoo,
2023-01-21 08:44:00,Is It Too Late to Buy Taiwan Semiconductor Manufacturing's Stock?,https://finance.yahoo.com/m/6314ab74-0824-3e5b-a7d9-d5db2072e157/is-it-too-late-to-buy-taiwan.html,finance.yahoo,
2023-01-21 06:50:00,Is Taiwan Semiconductor Stock a Buy Now?,https://finance.yahoo.com/m/0026e646-475b-3b3a-b3fa-f847b628d21d/is-taiwan-semiconductor-stock.html,finance.yahoo,
2023-01-21 06:45:00,Time to Buy Taiwan Semiconductor Manufacturing After Announcement of International Expansion Goals?,https://finance.yahoo.com/m/119bc77d-35f2-3bb6-94a7-b28ed01718cf/time-to-buy-taiwan.html,finance.yahoo,
2023-01-20 06:00:00,3 Growth Stocks You Can Buy Right Now With Less Than $100,https://finance.yahoo.com/m/a6ec1c64-1e35-35c0-9326-449dc5c76db9/3-growth-stocks-you-can-buy.html,finance.yahoo,
2023-01-19 08:04:00,Taiwan Semiconductor Looks Strong After Earnings,https://finance.yahoo.com/m/acc595b9-5f33-301d-b463-9f99dab2509e/taiwan-semiconductor-looks.html,finance.yahoo,
2023-01-19 08:00:00,Taiwan Semiconductor Continues to Crush It. Does That Make the Stock a Buy in 2023?,https://finance.yahoo.com/m/7aed5c66-b90b-3ca4-a8d9-19550acf24b2/taiwan-semiconductor.html,finance.yahoo,
2023-01-19 06:21:00,"TSMC, Samsung Likely To Feel Pinch Of Global Foundry Industry Slowdown In 2023: Report",https://finance.yahoo.com/news/tsmc-samsung-likely-feel-pinch-112149439.html,finance.yahoo,
2023-01-19 05:40:00,3 Things About Taiwan Semiconductor That Smart Investors Know,https://finance.yahoo.com/m/62aa01c9-a485-35bc-8e01-4dadda45106f/3-things-about-taiwan.html,finance.yahoo,
2023-01-19 02:54:00,"Global Foundry Sales Set to Drop in 2023 in Blow to Taiwan, South Korea",https://finance.yahoo.com/news/global-foundry-sales-set-drop-075459931.html,finance.yahoo,
2023-01-18 15:07:00,3 Companies Positively Surprising in Earnings Season,https://finance.yahoo.com/news/3-companies-positively-surprising-earnings-200708957.html,finance.yahoo,
2023-01-18 12:13:00,Analyst Report: Taiwan Semiconductor Manufacturing Company Limited,https://finance.yahoo.com/m/346c6549-3234-3bc0-a551-5e21875d0ce2/analyst-report%3A-taiwan.html,finance.yahoo,
2023-01-18 10:05:00,2 Unlikely Nasdaq Stocks Crushing the Market to Buy Hand Over Fist Right Now,https://finance.yahoo.com/m/a1d2d3cf-7c5e-36b8-a533-b35e6b91a7ad/2-unlikely-nasdaq-stocks.html,finance.yahoo,
2023-01-18 06:39:00,Technical Assessment: Neutral in the Intermediate-Term,https://finance.yahoo.com/m/dbcccef5-4f19-3e5c-b439-4bcee5f41cbf/technical-assessment%3A-neutral.html,finance.yahoo,
2023-01-17 14:58:00,"Why Semiconductor Stocks Taiwan Semiconductor, Nvidia, and Skyworks Solutions Rallied Today",https://finance.yahoo.com/m/0bc8634d-f258-3c4f-8422-ce36a450c06b/why-semiconductor-stocks.html,finance.yahoo,
2023-01-17 08:45:00,Better Buy: Nvidia vs. Taiwan Semiconductor Stock,https://finance.yahoo.com/m/c8e03aa8-cbb0-3ddd-acad-59a20374b4ac/better-buy%3A-nvidia-vs.-taiwan.html,finance.yahoo,
2023-01-17 08:30:00,TSMs Dividend History is Another Reason to Like the Stock,https://finance.yahoo.com/news/tsm-dividend-history-another-reason-133025043.html,finance.yahoo,
2023-01-17 06:03:00,3 Great Foreign Companies to Invest In Right Now,https://finance.yahoo.com/m/79bdf1cc-8a6a-3a82-9ad4-5015368c65b9/3-great-foreign-companies-to.html,finance.yahoo,
2023-01-16 10:40:00,2 Tech ETFs to Help You Capture the Sector's Rebound,https://finance.yahoo.com/m/ce35aa65-2f64-39b1-a919-f23880bd0611/2-tech-etfs-to-help-you.html,finance.yahoo,
2023-01-16 10:30:00,This Is Why Warren Buffett Bought This Semiconductor Stock,https://finance.yahoo.com/m/03475262-8735-3f58-8cb1-d53ac5d89c48/this-is-why-warren-buffett.html,finance.yahoo,
2023-01-16 09:53:00,3 Tech Stocks Approved by Warren Buffett,https://finance.yahoo.com/m/48c65b19-4175-39e0-811d-28934209538f/3-tech-stocks-approved-by.html,finance.yahoo,
2023-01-16 09:50:00,Taiwan Semiconductor Manufacturing Company Limited (NYSE:TSM) Q4 2022 Earnings Call Transcript,https://finance.yahoo.com/news/taiwan-semiconductor-manufacturing-company-limited-145007442.html,finance.yahoo,
2023-01-16 09:34:00,Is TSMC Stock a Buy Now?,https://finance.yahoo.com/m/b85076bb-83d3-377d-a824-d2dad06530a2/is-tsmc-stock-a-buy-now%3F.html,finance.yahoo,
2023-01-16 09:00:00,Investors Heavily Search Taiwan Semiconductor Manufacturing Company Ltd. (TSM): Here is What You Need to Know,https://finance.yahoo.com/news/investors-heavily-search-taiwan-semiconductor-140002275.html,finance.yahoo,
2023-01-16 06:31:00,"Credit Suisse, Just Eat, Alibaba, and More Market Movers",https://finance.yahoo.com/m/7b197dbb-ec3a-33e8-b46f-d2d524e70255/credit-suisse%2C-just-eat%2C.html,finance.yahoo,
2023-01-16 00:53:00,IQE tumbles after warning of demand hit from chipmakers,https://finance.yahoo.com/news/iqe-tumbles-warning-demand-hit-055345507.html,finance.yahoo,
2023-01-15 16:00:00,Taiwan Is Still Semiconductor Leader as Chip Exports Rise Again,https://finance.yahoo.com/news/taiwan-still-semiconductor-leader-chip-210000246.html,finance.yahoo,
2023-01-15 08:10:00,Could United Microelectronics Become the Next TSMC?,https://finance.yahoo.com/m/509be956-c828-3dec-932f-1f5f0acc0ba0/could-united-microelectronics.html,finance.yahoo,
2023-01-13 17:45:00,Morningstar | A Weekly Summary of Stock Ideas and Developments in the Companies We Cover,https://finance.yahoo.com/m/5458c60a-6877-32b0-8974-2e627d538f4e/morningstar-%7C-a-weekly.html,finance.yahoo,
2023-01-13 12:23:00,"Stock Market Rally Gains Steam As Inflation Cools; Tesla Price Cuts, Big Earnings In Focus: Weekly Review",https://finance.yahoo.com/m/e8fa1d42-1ab5-3255-b8df-83ba0a105418/stock-market-rally-gains.html,finance.yahoo,
2023-01-13 09:41:00,Chip-Stock Rally Flies in Face of Weakening Tech Outlook,https://finance.yahoo.com/news/chip-stock-rally-flies-face-144146619.html,finance.yahoo,
2023-01-13 07:12:00,Analyst Report: Taiwan Semiconductor Manufactu,https://finance.yahoo.com/m/cd9b0e23-d9b3-3a4b-96b7-2bf274a43854/analyst-report%3A-taiwan.html,finance.yahoo,
2023-01-13 06:57:00,"Market Digest: TSM, META",https://finance.yahoo.com/m/1eb006ac-8842-3cf0-84ee-e0a3e767d2b9/market-digest%3A-tsm%2C-meta.html,finance.yahoo,
2023-01-13 00:26:00,FirstFT: Biden faces probe over handling of files,https://finance.yahoo.com/m/5a3c24c0-55a9-326b-bd7c-a4b6288b5d22/firstft%3A-biden-faces-probe.html,finance.yahoo,
2023-01-12 20:52:00,TSMC Jumps as Investors Bet on Chip Giants Scale in Downturn,https://finance.yahoo.com/news/tsmc-jumps-investors-bet-chip-015225631.html,finance.yahoo,
2023-01-12 19:00:00,Taiwan Semiconductor Manufacturing (TSM) Q4 2022 Earnings Call Transcript,https://finance.yahoo.com/m/62ee7325-2da8-3b5d-8642-27def25e164f/taiwan-semiconductor.html,finance.yahoo,
2023-01-12 17:07:00,FirstFT: Investigation into Bidens handling of government docs,https://finance.yahoo.com/m/5a3c24c0-55a9-326b-bd7c-a4b6288b5d22/firstft%3A-investigation-into.html,finance.yahoo,
2023-01-12 16:05:00,"Taiwan Semiconductor Posts Mixed Fourth-Quarter Results, Guides Low",https://finance.yahoo.com/m/56ee9a7b-fd18-3736-9fa4-44ce2ea82a6d/taiwan-semiconductor-posts.html,finance.yahoo,
2023-01-12 15:54:00,Taiwan Semiconductor stock surges despite weakened guidance on Q4 earnings,https://finance.yahoo.com/video/taiwan-semiconductor-stock-surges-despite-205448002.html,finance.yahoo,
2023-01-12 14:34:00,TSMCs U.S. stock rallies as Wall Street talks about bottom in the chip sector,https://finance.yahoo.com/m/d9847c34-199d-33e6-9070-5459855e8cb5/tsmc%E2%80%99s-u.s.-stock-rallies-as.html,finance.yahoo,
2023-01-12 14:20:00,Why Zscaler Stock Was Slipping Today,https://finance.yahoo.com/m/28c322d3-ad79-3f2c-babb-10bf7e24ce4b/why-zscaler-stock-was.html,finance.yahoo,
2023-01-12 13:08:00,TSMCs Chip Recovery Outlook May Be a Pipe Dream,https://finance.yahoo.com/m/55e600c3-e1a0-328d-92ab-fc91bc7424b8/tsmc%E2%80%99s-chip-recovery-outlook.html,finance.yahoo,
2023-01-12 12:48:00,Why Taiwan Semiconductor Stock Was Climbing Today,https://finance.yahoo.com/m/a39f7cb3-b0e5-30d4-86a5-bbcb56eeecb9/why-taiwan-semiconductor.html,finance.yahoo,
2023-01-12 12:06:00,"TSMC Stock Surges On Record Profits, But Muted Outlook May Cloud Apple Earnings",https://finance.yahoo.com/m/d60ec3e7-99e0-32aa-a08b-cc582895878f/tsmc-stock-surges-on-record.html,finance.yahoo,
2023-01-12 11:54:00,Taiwan Semiconductor stock up as company expects easing to chip shortage,https://finance.yahoo.com/video/taiwan-semiconductor-stock-company-expects-165450911.html,finance.yahoo,
2023-01-12 11:18:00,"These Stocks Are Moving the Most Today: Logitech, Cinemark, Taiwan Semi, and More",https://finance.yahoo.com/m/207eb136-a869-368d-bc40-8c7bf2784a98/these-stocks-are-moving-the.html,finance.yahoo,
2023-01-12 10:39:00,3 Stocks Making News Thursday,https://finance.yahoo.com/news/3-stocks-making-news-thursday-153903511.html,finance.yahoo,
2023-01-12 10:21:00,Taiwan Semiconductor Braces for Downturn Despite Record Profit,https://finance.yahoo.com/m/061c1def-b020-36f1-8304-41fb590e1550/taiwan-semiconductor-braces.html,finance.yahoo,
2023-01-12 09:45:00,"Taiwan Semiconductor reports mixed earnings, calls out weak demand",https://finance.yahoo.com/video/taiwan-semiconductor-reports-mixed-earnings-144545008.html,finance.yahoo,
2023-01-12 08:53:00,Why Disney and Taiwan Semi Stocks Moved Higher Thursday,https://finance.yahoo.com/m/58e4ee3b-a79a-321b-b8c0-f2729917ba06/why-disney-and-taiwan-semi.html,finance.yahoo,
2023-01-12 08:27:00,"Subway Sandwich's Potential Sale, Walt Disney's CEO Faces New Challenge, Second Day of Flight Delays After System Outage: Today's Top Stories",https://finance.yahoo.com/news/subway-sandwichs-potential-sale-walt-132721322.html,finance.yahoo,
2023-01-12 07:29:00,TSMC Expects to Outsmart the Chip Downturn,https://finance.yahoo.com/m/21cc9b1a-db7c-3e47-a0ce-e8e3033894f1/tsmc-expects-to-outsmart-the.html,finance.yahoo,
2023-01-12 06:46:00,Nelson Peltz Attacks Disneys Magic Kingdom. Its a Taste of Boardroom Dramas Ahead.,https://finance.yahoo.com/m/28920313-2d01-3dd0-a0b0-dce6ff1349df/nelson-peltz-attacks-disney%E2%80%99s.html,finance.yahoo,
2023-01-12 06:35:00,"TSMC Warns of Possible Revenue Drop, Spending Cut",https://finance.yahoo.com/m/8607ef09-c5fe-3bc4-a87c-63514f556832/tsmc-warns-of-possible.html,finance.yahoo,
2023-01-12 06:07:00,"TSMC Stock Higher On Record Profits, But Muted Outlook May Cloud Apple Earnings",https://finance.yahoo.com/m/d60ec3e7-99e0-32aa-a08b-cc582895878f/tsmc-stock-higher-on-record.html,,finance.yahoo
2023-01-12 06:00:00,1 Bargain Buffett Stock to Buy Hand Over Fist in 2023,https://finance.yahoo.com/m/2f3ccdf3-ffc6-315c-831c-2dec2914950e/1-bargain-buffett-stock-to.html,,finance.yahoo
2023-01-12 05:57:00,1 Warren Buffett Stock Is Cheaper Than It Has Been in Years -- Is 2023 the Time to Buy?,https://finance.yahoo.com/m/d14297dd-193c-356a-a44f-c442946b6e34/1-warren-buffett-stock-is.html,,finance.yahoo
2023-01-12 05:25:00,"Stocks Slip Lower, Inflation Data On Deck, Disney, TSMC, KB Home - Five Things To Know",https://finance.yahoo.com/m/580528f9-355f-3449-b667-be673f462951/stocks-slip-lower%2C-inflation.html,,finance.yahoo
2023-01-12 05:20:00,Where Will TSMC Stock Be in 1 Year?,https://finance.yahoo.com/m/6c6f5dfc-838e-3693-ae85-3babae369996/where-will-tsmc-stock-be-in-1.html,,finance.yahoo
2023-01-12 04:30:00,Chip Giant TSMC Plans to Cut Spending to Offset Falling Near-Term Sales,https://finance.yahoo.com/news/world-biggest-chipmaker-tsmc-tops-060729364.html,,finance.yahoo
2023-01-12 03:29:00,TSMC Chief Sees End to Chip Shortage That Hammered Auto Industry,https://finance.yahoo.com/news/tsmc-chief-sees-end-chip-082958129.html,,finance.yahoo
2023-01-12 03:19:00,TSMC gives cautious outlook despite strong earnings,https://finance.yahoo.com/m/132a4abf-ba36-3806-8631-31df69eb8776/tsmc-gives-cautious-outlook.html,,finance.yahoo
2023-01-12 01:31:00,Taiwan Semiconductor Manufacturing reports record net profit and revenue on chip demand,https://finance.yahoo.com/m/ed541029-46bc-36cd-8d0b-85a816b0fd83/taiwan-semiconductor.html,,finance.yahoo
2023-01-12 00:43:00,UPDATE 4-TSMC cuts 2023 capex after record Q4 as chip demand weakens,https://finance.yahoo.com/news/1-tsmc-q4-profit-rises-054306494.html,,finance.yahoo
2023-01-12 00:37:00,TSMC cuts 2023 capex after record Q4 as chip demand weakens,https://finance.yahoo.com/news/tsmc-q4-profit-78-beats-053716167.html,,finance.yahoo
