Date,Title,Link,Source,source
2023-01-30 13:08:00,Ford cuts price of Mustang Mach-E as EV industry competition heats up,https://finance.yahoo.com/m/af634086-4b13-370b-9f03-2150691ee34b/ford-cuts-price-of-mustang.html,,finance.yahoo
2023-01-30 12:31:00,Ford Enters Tesla's EV Price War,https://finance.yahoo.com/m/6608d61c-d27b-3d48-b6e6-6aa1f707f62f/ford-enters-tesla%27s-ev-price.html,,finance.yahoo
2023-01-30 12:31:00,[HOLD] Ford Enters Tesla's EV Price War,https://finance.yahoo.com/m/6608d61c-d27b-3d48-b6e6-6aa1f707f62f/%5Bhold%5D-ford-enters-tesla%27s-ev.html,,finance.yahoo
2023-01-30 12:15:00,Auto Stocks Fall After Ford Cuts Electric Mustang Prices,https://finance.yahoo.com/m/c4dede1b-d97f-3497-ad70-f51f55791999/auto-stocks-fall-after-ford.html,,finance.yahoo
2023-01-30 11:41:00,"Ford to boost Mustang Mach-E production, lower prices",https://finance.yahoo.com/video/ford-boost-mustang-mach-e-164151815.html,,finance.yahoo
2023-01-30 11:22:00,Ford cuts Mustang Mach-E prices following Tesla price drops,https://finance.yahoo.com/news/ford-cuts-mustang-mach-e-prices-following-tesla-price-drops-162211985.html,,finance.yahoo
2023-01-30 11:21:00,Ford Slashes Electric Mustangs Price in Response to Tesla,https://finance.yahoo.com/news/ford-slashes-electric-mustang-price-162153715.html,,finance.yahoo
