Date,Title,Link,Source,source
2023-02-10 18:52:00,Ford Plans to Build EV Battery Plant in Michigan With Chinese Partner,https://finance.yahoo.com/news/ford-plans-build-ev-battery-211213659.html,finance.yahoo,
2023-02-10 16:56:00,"UPDATE 2-Ford to announce $3.5 bln battery plant in Michigan, sources say",https://finance.yahoo.com/news/1-ford-announce-3-5-215620447.html,finance.yahoo,
2023-02-10 16:32:00,"Ford to announce $3.5 billion battery plant in Michigan, sources say",https://finance.yahoo.com/news/ford-announce-3-5-billion-213256941.html,finance.yahoo,
2023-02-10 13:30:00,Lithium Battery Production By Country: Top 12 Countries,https://finance.yahoo.com/news/lithium-battery-production-country-top-183050554.html,finance.yahoo,
2023-02-10 10:22:00,Ford Stock Is Falling. Its Because Management Did Something Right.,https://finance.yahoo.com/m/f26f781b-891f-37e7-96e3-f64a9e86f584/ford-stock-is-falling.-it%E2%80%99s.html,finance.yahoo,
2023-02-10 09:39:00,10 Best Three-Row SUVs in 2023,https://finance.yahoo.com/news/10-best-three-row-suvs-143927426.html,finance.yahoo,
2023-02-10 09:26:00,"Ford Chief Highlights Transparent Goals and Performance Yardsticks For Employees, Cost Cuts For Better Supply Chain Management",https://finance.yahoo.com/news/ford-chief-highlights-transparent-goals-142643016.html,finance.yahoo,
2023-02-10 09:12:00,Ford Pares Stake In EV Maker Rivian After Reporting Significant Write-Down,https://finance.yahoo.com/news/ford-pares-stake-ev-maker-141225137.html,finance.yahoo,
2023-02-10 08:50:00,Ford cuts Rivian stake to about 1%,https://finance.yahoo.com/news/ford-cuts-rivian-stake-1-135017219.html,finance.yahoo,
2023-02-10 08:31:00,Ford Stock Is Falling. The Reason Is a Mystery.,https://finance.yahoo.com/m/f26f781b-891f-37e7-96e3-f64a9e86f584/ford-stock-is-falling.-the.html,finance.yahoo,
2023-02-09 17:28:00,UPDATE 1-U.S. set to loan Redwood Materials $2 bln for EV materials plant,https://finance.yahoo.com/news/1-u-set-loan-redwood-222827119.html,finance.yahoo,
2023-02-09 16:41:00,"Ford CEO Tells Employees They Need Clearer Goals, Performance Metrics",https://finance.yahoo.com/m/038e1a99-9bd7-3b55-ba74-667a9641f68d/ford-ceo-tells-employees-they.html,finance.yahoo,
2023-02-09 14:25:00,U.S. set to loan Redwood Materials $2 billion for EV materials plant,https://finance.yahoo.com/news/redwood-materials-says-wins-2-192534330.html,finance.yahoo,
2023-02-09 12:40:00,"Ford CEO Says Employees Need Clearer Goals, Performance Metrics",https://finance.yahoo.com/m/038e1a99-9bd7-3b55-ba74-667a9641f68d/ford-ceo-says-employees-need.html,finance.yahoo,
2023-02-09 12:21:00,UPDATE 1-GM inks deal with GlobalFoundries to secure U.S.-made chips,https://finance.yahoo.com/news/1-gm-inks-deal-globalfoundries-172157742.html,finance.yahoo,
2023-02-09 12:00:00,Redwood Materials says it wins $2 bln DOE loan for EV materials plant,https://finance.yahoo.com/news/redwood-materials-says-wins-2-170000826.html,finance.yahoo,
2023-02-09 11:49:00,"Auto news roundup: Tesla stock doubles from low, Toyota higher on earnings beat",https://finance.yahoo.com/news/auto-news-roundup-tesla-stock-doubles-from-low-toyota-higher-on-earnings-beat-164903157.html,finance.yahoo,
2023-02-09 11:32:00,GM inks deal with GlobalFoundries to secure U.S.-made chips,https://finance.yahoo.com/news/gm-inks-agreement-globalfoundries-secure-163229379.html,finance.yahoo,
2023-02-09 11:30:00,GM inks agreement with GlobalFoundries to secure chips made in the U.S.,https://finance.yahoo.com/news/gm-inks-agreement-globalfoundries-secure-163000201.html,finance.yahoo,
2023-02-09 08:37:00,12 Countries that Produce the Most Cars in the World,https://finance.yahoo.com/news/12-countries-produce-most-cars-133758295.html,finance.yahoo,
2023-02-09 05:06:00,"3 High-Yield Dividend Stocks With 34% to 59% Upside In 2023, According to Wall Street",https://finance.yahoo.com/m/3de90cda-cc72-3d22-bfd8-153aae461102/3-high-yield-dividend-stocks.html,finance.yahoo,
2023-02-08 12:45:00,Elon Musk to unveil Teslas Master Plan 3 on investor day  heres what to expect,https://finance.yahoo.com/m/e9c616b2-b3ac-37bd-b071-6161ec9758a5/elon-musk-to-unveil-tesla%E2%80%99s.html,finance.yahoo,
2023-02-08 10:37:00,10 Most Advanced Countries in Battery Technology,https://finance.yahoo.com/news/10-most-advanced-countries-battery-153754101.html,finance.yahoo,
2023-02-08 08:45:00,"Ford Stock: The Good, the Bad, and the Ugly",https://finance.yahoo.com/m/62885f23-018e-3fa0-8cb9-a327a6f36703/ford-stock%3A-the-good%2C-the.html,finance.yahoo,
2023-02-08 06:01:00,Why Ford Motor Company (NYSE:F) Could Be Worth Watching,https://finance.yahoo.com/news/why-ford-motor-company-nyse-110110720.html,finance.yahoo,
2023-02-07 15:53:00,Tesla raises price of Model Y amid Treasury Departments revisions to EV tax credit,https://finance.yahoo.com/video/tesla-raises-price-model-y-205352995.html,finance.yahoo,
2023-02-07 12:30:00,Ford Faces Growing Pains As It Expands Into The EV Market,https://finance.yahoo.com/news/ford-faces-growing-pains-expands-173000615.html,finance.yahoo,
2023-02-07 10:47:00,15 Best High Volume Stocks To Buy Today,https://finance.yahoo.com/news/15-best-high-volume-stocks-154729523.html,finance.yahoo,
2023-02-07 10:44:00,UPDATE 1-Ford works council in Germany to update staff on job cut talks on Feb 14,https://finance.yahoo.com/news/1-ford-works-council-germany-154445677.html,finance.yahoo,
2023-02-07 10:25:00,Ford works council in Germany to update staff on job cut talks on Feb 14,https://finance.yahoo.com/news/ford-works-council-germany-staff-152536793.html,finance.yahoo,
2023-02-07 10:21:00,"Auto Roundup: GM Tops Q4 Earnings Mark, Ford Misses & More",https://finance.yahoo.com/news/auto-roundup-gm-tops-q4-152103238.html,finance.yahoo,
2023-02-07 08:03:00,25 Least Developed Countries in Africa,https://finance.yahoo.com/news/25-least-developed-countries-africa-130309768.html,finance.yahoo,
2023-02-07 07:19:00,Analyst Report: Ford Motor Co.,https://finance.yahoo.com/m/ea1ab1cb-2c1f-36cd-b1d7-f4093ea3102e/analyst-report%3A-ford-motor-co..html,finance.yahoo,
2023-02-07 07:04:00,"Market Digest: COP, F, VIAV, JNPR, MAN, MET, TMUS, PH",https://finance.yahoo.com/m/6c968b7a-3e82-3c7b-9207-ec6002ee8763/market-digest%3A-cop%2C-f%2C-viav%2C.html,finance.yahoo,
2023-02-06 17:36:00,Fords CEO is the new face of a more efficient corporate America after getting candid and hinting at more layoffs: It takes us 25% more engineers to do the same work,https://finance.yahoo.com/news/ford-ceo-face-more-efficient-223650035.html,finance.yahoo,
2023-02-06 14:00:00,"Ford CEO Farley, CFO Lawler to Describe Ford+ Growth Plan, Execution Priorities at Feb. 15 Wolfe Global Auto Conference",https://finance.yahoo.com/news/ford-ceo-farley-cfo-lawler-190000280.html,finance.yahoo,
2023-02-06 13:53:00,C-Suite Rides: The mud-magnet Ford Bronco Raptor is no wimpy SUV (PHOTOS),https://finance.yahoo.com/m/dbc38af9-715f-3786-a034-64b69fdb9656/c-suite-rides%3A-the-mud-magnet.html,finance.yahoo,
2023-02-06 10:37:00,Ford has bigger problems than an EV price war,https://finance.yahoo.com/m/1efd9824-f3c4-3748-ad15-157128986600/ford-has-bigger-problems-than.html,finance.yahoo,
2023-02-06 09:32:00,"Company News for Feb 6, 2023",https://finance.yahoo.com/news/company-news-feb-6-2023-143202476.html,finance.yahoo,
2023-02-06 09:00:00,Is Trending Stock Ford Motor Company (F) a Buy Now?,https://finance.yahoo.com/news/trending-stock-ford-motor-company-140002643.html,finance.yahoo,
2023-02-06 07:00:00,Tesla vs. Ford: What Their Price Cuts Mean for the EV Industry,https://finance.yahoo.com/video/tesla-vs-ford-price-cuts-120000696.html,finance.yahoo,
2023-02-06 04:56:00,Ford cut to sell at Deutsche Bank after earnings miss,https://finance.yahoo.com/m/38fab0d4-0c5d-3f6e-93ab-a02d36952adf/ford-cut-to-sell-at-deutsche.html,finance.yahoo,
2023-02-06 02:03:00,6 big dividends this week: Public Storage payout rockets 50%,https://finance.yahoo.com/news/6-big-dividends-week-public-070313838.html,finance.yahoo,
2023-02-05 06:00:00,Electric vehicles defy price war after Ford and Tesla discounts,https://finance.yahoo.com/m/69f569f0-2444-3edc-be97-289b8bea34f9/electric-vehicles-defy-price.html,finance.yahoo,
2023-02-04 21:24:00,Ford Has Good News For Fans of Its EVs,https://finance.yahoo.com/m/753d9123-c174-3339-be3d-facb65a85f03/ford-has-good-news-for-fans.html,finance.yahoo,
2023-02-04 08:00:00,Ford vs. GM: A tale of two automakers,https://finance.yahoo.com/news/ford-vs-gm-tale-two-130015643.html,finance.yahoo,
2023-02-04 08:00:00,Best Stock to Buy: Ford Stock vs. Plug Power Stock,https://finance.yahoo.com/m/f7b75515-c340-3fb4-bb06-a3db164aafac/best-stock-to-buy%3A-ford-stock.html,finance.yahoo,
2023-02-03 19:08:00,Why Ford Stock Fell On Friday,https://finance.yahoo.com/m/ca339ae0-85ae-34c5-9714-61885924b1b6/why-ford-stock-fell-on-friday.html,finance.yahoo,
2023-02-03 18:29:00,Weekly Roundup,https://finance.yahoo.com/m/848d52d6-7eb7-3f31-9114-1e97fd26c959/weekly-roundup.html,finance.yahoo,
2023-02-03 18:06:00,Why Ford Stock Jumped 16% in January,https://finance.yahoo.com/m/f354035d-59fa-3c72-a2fe-96b37c513855/why-ford-stock-jumped-16%25-in.html,finance.yahoo,
2023-02-03 17:16:00,The Biggest Reason Why Rivian Could Be a Dark Horse EV Stock in 2023,https://finance.yahoo.com/m/fd8f1ab7-3050-3819-ac6d-43630b035bdd/the-biggest-reason-why-rivian.html,finance.yahoo,
2023-02-03 16:18:00,"IRS Boosts Tesla Stock, Ford, With Redo of Tax Credits for  Key EVs",https://finance.yahoo.com/m/b8e2ced0-f2c0-3d58-ac52-65f0958ab13e/irs-boosts-tesla-stock%2C-ford%2C.html,finance.yahoo,
2023-02-03 16:12:00,Tesla Stock Charges Up On Government Revision To EV Tax Credits,https://finance.yahoo.com/m/4f877d38-2ae5-3875-91c8-718d34f8813e/tesla-stock-charges-up-on.html,finance.yahoo,
2023-02-03 15:35:00,Ford CEO defends earnings after leaving $2 billion in profits 'on the table,https://finance.yahoo.com/video/ford-ceo-defends-earnings-leaving-203514792.html,finance.yahoo,
2023-02-03 15:08:00,Ford Motor Company (NYSE:F) Q4 2022 Earnings Call Transcript,https://finance.yahoo.com/news/ford-motor-company-nyse-f-200814783.html,finance.yahoo,
2023-02-03 14:51:00,We've Dug Deeper Into 4 High Profile Portfolio Earnings Reports,https://finance.yahoo.com/m/ef9ddfce-f03e-332b-8d9c-2d4aad591daa/we%27ve-dug-deeper-into-4-high.html,finance.yahoo,
2023-02-03 14:22:00,Yahoo Finance Presents: Ford President & CEO Jim Farley,https://finance.yahoo.com/video/yahoo-finance-presents-ford-president-192213098.html,finance.yahoo,
2023-02-03 14:05:00,Ford CEO: Red Bull F1 partnership will highlight our EV technology,https://finance.yahoo.com/news/ford-ceo-red-bull-f1-partnership-will-highlight-our-ev-technology-190548426.html,finance.yahoo,
2023-02-03 13:36:00,Ford stock falls as Wall Street eyes this key concern after earnings,https://finance.yahoo.com/news/ford-stock-falls-as-wall-street-eyes-this-key-concern-after-earnings-183634227.html,finance.yahoo,
2023-02-03 13:09:00,More EVs to Qualify for Tax Credit Following Treasury Changes,https://finance.yahoo.com/m/4fb32e9c-dff6-31c7-a400-3f523ec2ed8c/more-evs-to-qualify-for-tax.html,finance.yahoo,
2023-02-03 12:55:00,"Ford (F) Q4 Earnings Miss Estimates, Sales Grow 17% Y/Y",https://finance.yahoo.com/news/ford-f-q4-earnings-miss-175505191.html,finance.yahoo,
2023-02-03 12:19:00,Tesla stock rips higher as IRS boosts Model Y EV tax credit eligibility,https://finance.yahoo.com/news/tesla-stock-rips-higher-as-irs-boosts-model-y-ev-tax-credit-eligibility-171933283.html,finance.yahoo,
2023-02-03 12:02:00,Ford Slides as CEO Says $2 Billion Profit Left on Table,https://finance.yahoo.com/news/ford-slides-ceo-says-2-115201895.html,finance.yahoo,
2023-02-03 12:02:00,Is VinFast a long shot for North Carolina?,https://finance.yahoo.com/m/a0c7854a-f80f-3f50-8f6e-d5792e8a7fc7/is-vinfast-a-long-shot-for.html,finance.yahoo,
2023-02-03 11:44:00,Ford's pain underscores uneven impact of two-year auto chip shortage,https://finance.yahoo.com/news/fords-pain-underscores-uneven-impact-164405405.html,finance.yahoo,
2023-02-03 11:25:00,"Ford Mach-E Sales Fall 45%. The Reasons: High Prices, Incentive Confusion.",https://finance.yahoo.com/m/2794874f-50fc-3398-a0be-cf6bfd218fd9/ford-mach-e-sales-fall-45%25..html,finance.yahoo,
2023-02-03 11:24:00,Ford Shares Slip After Company Highlights Execution Issues,https://finance.yahoo.com/m/2706f06a-ae18-3b8e-a5b1-4b8ab9a84cca/ford-shares-slip-after.html,finance.yahoo,
2023-02-03 11:20:00,Ford Returns to F1 as Racing Series Sees Surge in Popularity,https://finance.yahoo.com/news/ford-returns-f1-racing-series-131501736.html,finance.yahoo,
2023-02-03 10:52:00,"Ford reports $2B net loss for 2022, 'sweeping leadership changes'",https://finance.yahoo.com/m/3cce2511-c4fa-3b3a-8ee4-9e987d419944/ford-reports-%242b-net-loss-for.html,finance.yahoo,
2023-02-03 10:14:00,"UPDATE 2-U.S. says more Tesla, Ford, GM EVs eligible for tax credits",https://finance.yahoo.com/news/1-u-treasury-makes-more-151440772.html,finance.yahoo,
2023-02-03 09:53:00,Ford Breaks Down On Q4 Earnings Miss After GM's Beat-And-Raise,https://finance.yahoo.com/m/203d1c31-f3fa-3ee1-a823-9e02c633476a/ford-breaks-down-on-q4.html,finance.yahoo,
2023-02-03 09:39:00,Here's Our Take on the Latest Earnings and the Jobs Report,https://finance.yahoo.com/m/2f93d4b8-7138-3963-a636-86a7e9185262/here%27s-our-take-on-the-latest.html,finance.yahoo,
2023-02-03 09:00:00,Ford Motor Company (NYSE:F) Shares Could Be 41% Below Their Intrinsic Value Estimate,https://finance.yahoo.com/news/ford-motor-company-nyse-f-140035155.html,finance.yahoo,
2023-02-03 08:44:00,Here's Why Nio and Ford Could Be 2023's Top EV Growth Stocks,https://finance.yahoo.com/m/1ef42b09-8d4c-3853-a9b7-c8cf7e931f72/here%27s-why-nio-and-ford-could.html,finance.yahoo,
2023-02-03 08:36:00,Motor racing-Ford returning to Formula One in 2026,https://finance.yahoo.com/news/motor-racing-ford-returning-formula-133637241.html,finance.yahoo,
2023-02-03 08:15:00,"Dow Jones Futures Fall As Apple, Google, Amazon Skid, Jobs Report Looms; Market Rally Due For Pullback?",https://finance.yahoo.com/m/e219f16e-3134-3728-9598-aa34aa23b1fa/dow-jones-futures-fall-as.html,finance.yahoo,
2023-02-03 07:18:00,Fords Profit Engine Needs a Full Overhaul,https://finance.yahoo.com/m/e5e7d5df-844b-3b32-a90d-09daf7cdfbf5/ford%E2%80%99s-profit-engine-needs-a.html,finance.yahoo,
2023-02-03 07:06:00,Ford Earnings Miss After Rival GM's Beat-And-Raise; F Stock Dives,https://finance.yahoo.com/m/203d1c31-f3fa-3ee1-a823-9e02c633476a/ford-earnings-miss-after.html,finance.yahoo,
2023-02-03 06:40:00,Ford Earnings Miss With $2 Billion In Profits Left 'On The Table'; F Stock Dives,https://finance.yahoo.com/m/203d1c31-f3fa-3ee1-a823-9e02c633476a/ford-earnings-miss-with-%242.html,finance.yahoo,
2023-02-03 04:30:00,Ford Motor Company (F) Q4 2022 Earnings Call Transcript,https://finance.yahoo.com/m/1c52e621-503e-345e-a10c-d1e9fba97d4c/ford-motor-company-%28f%29-q4.html,finance.yahoo,
2023-02-03 03:10:00,Here's What Key Metrics Tell Us About Ford Motor Company (F) Q4 Earnings,https://finance.yahoo.com/news/heres-key-metrics-tell-us-081008082.html,finance.yahoo,
2023-02-03 01:19:00,"In case you missed it, 6 big dividends: Ford, Quest Diagnostics",https://finance.yahoo.com/news/case-missed-6-big-dividends-061957411.html,finance.yahoo,
2023-02-03 00:39:00,Analyst Report: Ford Motor Company,https://finance.yahoo.com/m/412d91f6-a23b-305e-9d7c-351d1c6335af/analyst-report%3A-ford-motor.html,finance.yahoo,
2023-02-02 22:14:00,"Dow Jones Futures: Apple, Google, Amazon Skid, Jobs Report Looms; Market Rally Due For Pullback?",https://finance.yahoo.com/m/e219f16e-3134-3728-9598-aa34aa23b1fa/dow-jones-futures%3A-apple%2C.html,finance.yahoo,
2023-02-02 17:35:00,Ford Motor Company (F) Q4 Earnings Lag Estimates,https://finance.yahoo.com/news/ford-motor-company-f-q4-223510675.html,finance.yahoo,
2023-02-02 17:07:00,"Ford Posts $1.3 Billion Fourth-Quarter Profit, Misses Full-Year Profit Guidance",https://finance.yahoo.com/m/55856c05-c5a3-3dbc-bffe-aaa449727f87/ford-posts-%241.3-billion.html,finance.yahoo,
2023-02-02 16:35:00,"Ford logs $2 billion loss in 2022, says profit was left on the table",https://finance.yahoo.com/m/e4b02313-8b29-312f-ab96-2a223215ac74/ford-logs-%242-billion-loss-in.html,finance.yahoo,
2023-02-02 16:34:00,Ford earnings: Stock drops sharply after missing Q4 EPS estimates,https://finance.yahoo.com/video/ford-earnings-stock-drops-sharply-213434730.html,finance.yahoo,
2023-02-02 16:19:00,"UPDATE 3-Ford quarterly profit falls, shares drop after bell",https://finance.yahoo.com/news/1-ford-2022-profit-short-211959118.html,finance.yahoo,
2023-02-02 16:16:00,"Ford posts lower profit, issues downbeat outlook; shares drop",https://finance.yahoo.com/news/fords-full-profit-short-expectations-211624229.html,finance.yahoo,
2023-02-02 16:05:00,"People, Plan, Products Position Ford Well for Pivotal 2023 Despite Effect of Volume Shortfall on Q4, Full-Year 2022 Results",https://finance.yahoo.com/news/people-plan-products-position-ford-210500280.html,finance.yahoo,
2023-02-02 16:02:00,"Auto sales: 'Inventory is still going to be the name of the game,' strategist says",https://finance.yahoo.com/video/auto-sales-inventory-still-going-210248968.html,finance.yahoo,
2023-02-02 15:15:00,"Ford Motor Co. boosts top-selling electric vehicle (EV) production, cuts Mach-E prices",https://finance.yahoo.com/m/5d28a61d-a438-3ce2-ae2f-68a9fc5bd443/ford-motor-co.-boosts.html,finance.yahoo,
2023-02-02 14:25:00,"Ford is all-in on all-electric, but what does that mean for the Buffalo plant?",https://finance.yahoo.com/m/f48b7927-a700-3522-aa65-4852414068e7/ford-is-all-in-on.html,finance.yahoo,
2023-02-02 12:44:00,Cathie Wood on Tesla price cuts: Rival EV makers will 'have trouble keeping up',https://finance.yahoo.com/news/cathie-wood-on-tesla-price-cuts-rival-ev-makers-will-have-trouble-keeping-up-174435735.html,finance.yahoo,
2023-02-02 12:15:00,"Ford Earnings Due After Solid Sales Start To 2023, Led By Electric Vehicles",https://finance.yahoo.com/m/203d1c31-f3fa-3ee1-a823-9e02c633476a/ford-earnings-due-after-solid.html,finance.yahoo,
2023-02-02 12:15:00,"Ford Earnings Due After Mixed Sales Start To 2023, With Gains Led By Electric Vehicles",https://finance.yahoo.com/m/203d1c31-f3fa-3ee1-a823-9e02c633476a/ford-earnings-due-after-mixed.html,finance.yahoo,
2023-02-02 12:02:00,Ford earnings: What to expect,https://finance.yahoo.com/video/ford-earnings-expect-170214808.html,finance.yahoo,
2023-02-02 09:53:00,Ford earnings preview: Expectations are high following GM's blowout quarter,https://finance.yahoo.com/news/ford-fourth-quarter-earnings-february-2-2023-145214798.html,finance.yahoo,
2023-02-02 07:57:00,Best Dividend Stock To Buy: Verizon Stock vs. Ford Stock,https://finance.yahoo.com/m/18a950c4-75a5-36a1-9ee6-98564a60017f/best-dividend-stock-to-buy%3A.html,,finance.yahoo
2023-02-02 07:07:00,Ford Earnings Due After Auto Giant Cut Prices In 'EV War' With Tesla,https://finance.yahoo.com/m/203d1c31-f3fa-3ee1-a823-9e02c633476a/ford-earnings-due-after-auto.html,,finance.yahoo
2023-02-02 05:21:00,4 High-Yield Dividend Stocks Billionaires Can't Stop Buying,https://finance.yahoo.com/m/9e28baf8-78cd-3823-be9d-77b1222b31f1/4-high-yield-dividend-stocks.html,,finance.yahoo
2023-02-01 17:01:00,Ford could honor rebate for new Mustang Mach-E owners after dropping price,https://finance.yahoo.com/video/ford-could-honor-rebate-mustang-220118666.html,,finance.yahoo
2023-02-01 16:15:00,Car buyers face inhibiting factors for EV adoption: Mazda USA CEO,https://finance.yahoo.com/news/car-buyers-face-inhibiting-factors-for-ev-adoption-mazda-usa-ceo-211518127.html,,finance.yahoo
2023-02-01 13:40:00,"Dow futures flat as Fed hikes 0.25%, Meta surges 19.4% after results",https://finance.yahoo.com/news/dow-futures-flat-fed-hikes-184026548.html,,finance.yahoo
2023-02-01 12:49:00,UPDATE 1-EV maker Rivian to cut 6% of jobs amid price war -internal memo,https://finance.yahoo.com/news/1-ev-maker-rivian-cut-174958872.html,,finance.yahoo
2023-02-01 12:09:00,"Ford gaining traffic in the EV market, analyst says",https://finance.yahoo.com/video/ford-gaining-traffic-ev-market-170911420.html,,finance.yahoo
2023-02-01 10:39:00,Ford Mustang Mach-E rebate: Heres how it might work,https://finance.yahoo.com/news/ford-mustang-mach-e-rebate-heres-how-it-might-work-153921847.html,,finance.yahoo
2023-02-01 10:12:00,Henry Ford Bought a Newspaper. Its a Warning for Elon Musk.,https://finance.yahoo.com/m/b11936f2-f0d7-3800-a89a-c916ddb63afa/henry-ford-bought-a.html,,finance.yahoo
2023-02-01 10:01:00,Henry Ford Bought a Newspaper at the Height of His Career. Its a Warning for Elon Musk.,https://finance.yahoo.com/m/b11936f2-f0d7-3800-a89a-c916ddb63afa/henry-ford-bought-a-newspaper.html,,finance.yahoo
2023-02-01 09:03:00,"Auto Sector Q4 Earnings Roster for Feb 2: F, HOG & More",https://finance.yahoo.com/news/auto-sector-q4-earnings-roster-140302230.html,,finance.yahoo
2023-02-01 08:56:00,Ford Earnings Due As Automaker Pursues Model-T Strategy For EV Sales,https://finance.yahoo.com/m/203d1c31-f3fa-3ee1-a823-9e02c633476a/ford-earnings-due-as.html,,finance.yahoo
2023-02-01 08:04:00,"Fed Day Is Here, Wild Market, Hottest Index, Employment, Ford Earnings",https://finance.yahoo.com/m/de605600-e612-3568-a19d-4d0c629f28d3/fed-day-is-here%2C-wild-market%2C.html,,finance.yahoo
2023-02-01 07:30:00,Ford Slashes EV Prices Following Tesla as Price Wars Intensify,https://finance.yahoo.com/m/9afbbef9-2487-3e87-ab39-0b08521c6ccc/ford-slashes-ev-prices.html,,finance.yahoo
2023-02-01 02:15:00,What Elon Musk Can Learn From Henry Ford,https://finance.yahoo.com/m/b11936f2-f0d7-3800-a89a-c916ddb63afa/what-elon-musk-can-learn-from.html,,finance.yahoo
2023-01-31 19:13:00,Ford's Profit Likely Surged as Supply Chains Improved,https://finance.yahoo.com/m/0467f767-645f-34f9-8d9a-2564e66892d3/ford%27s-profit-likely-surged.html,,finance.yahoo
2023-01-31 16:48:00,"Tesla and Ford are cutting auto prices, but GM says it wont",https://finance.yahoo.com/m/91d028f1-5e62-3805-9c83-858d69fd006f/tesla-and-ford-are-cutting.html,,finance.yahoo
2023-01-31 16:09:00,"Tesla CEO Elon Musk would 'be silly' to slash prices again, analyst says",https://finance.yahoo.com/news/tesla-ceo-elon-musk-would-be-silly-to-slash-prices-again-analyst-says-210941421.html,,finance.yahoo
2023-01-31 15:37:00,"General Motors opts to maintain EV prices as competition with Ford, Tesla revs up",https://finance.yahoo.com/video/general-motors-opts-maintain-ev-203746067.html,,finance.yahoo
2023-01-31 14:42:00,General Motors CFO on recession risk: We see continued strength,https://finance.yahoo.com/news/general-motors-cfo-on-recession-risk-we-see-continued-strength-194258284.html,,finance.yahoo
2023-01-31 14:33:00,"GM says no to price cuts, diverging from rivals Tesla and Ford",https://finance.yahoo.com/m/91d028f1-5e62-3805-9c83-858d69fd006f/gm-says-no-to-price-cuts%2C.html,,finance.yahoo
2023-01-31 13:21:00,Why Ford Stock Is in the Fast Lane Today,https://finance.yahoo.com/m/b24af28f-62c8-3a49-9324-39d52f76b8b1/why-ford-stock-is-in-the-fast.html,,finance.yahoo
2023-01-31 12:45:00,Ford Cuts Cost of Mustang Mach-E Weeks After Tesla Drops EV Prices,https://finance.yahoo.com/news/ford-cuts-cost-mustang-mach-174518331.html,,finance.yahoo
2023-01-31 12:27:00,Teslas EV Price War Is an All-Out Game of Thrones Battle,https://finance.yahoo.com/m/32ff033e-4603-3c5e-ab3a-498733fa8be7/tesla%E2%80%99s-ev-price-war-is-an.html,,finance.yahoo
2023-01-31 10:04:00,"GM Beats on Profit and Sales, Shrugs Off EV Price War Worry",https://finance.yahoo.com/news/gm-beats-profit-sales-sees-114610275.html,,finance.yahoo
2023-01-31 09:34:00,"Company News for Jan 31, 2023",https://finance.yahoo.com/news/company-news-jan-31-2023-143402696.html,,finance.yahoo
2023-01-31 08:36:00,"Midday movers: General Motors, McDonald's, Pfizer and more",https://finance.yahoo.com/news/midday-movers-general-motors-mcdonalds-133601042.html,,finance.yahoo
2023-01-31 08:13:00,Top 25 Lowest P/E Ratios of the S&P 500,https://finance.yahoo.com/news/top-25-lowest-p-e-131326336.html,,finance.yahoo
2023-01-31 07:29:00,The end of the EV premium? Deflation hits auto industry as Ford ups stakes in electric car price war with Tesla,https://finance.yahoo.com/news/end-ev-premium-deflation-hits-122941215.html,,finance.yahoo
2023-01-31 06:39:00,Stock market: 3 stunning stats from January 2023's spirited move,https://finance.yahoo.com/news/stock-market-3-stunning-stats-from-january-2023s-spirited-move-113954528.html,,finance.yahoo
2023-01-31 06:19:00,January Has Turned Last Years Losers into Winners. Can It Last?,https://finance.yahoo.com/m/bd23dbb0-1beb-3241-bc4f-25ecf53f73de/january-has-turned-last.html,,finance.yahoo
2023-01-30 19:00:00,Ford Slashes Price of Mustang Mach-E,https://finance.yahoo.com/m/5f2b7a97-f382-37cb-81f7-bfa35a7c5c5d/ford-slashes-price-of-mustang.html,,finance.yahoo
2023-01-30 17:01:00,Ford Cuts Prices of EV Mustang Mach-E,https://finance.yahoo.com/m/360a0350-ce4d-392a-ba1e-fcb4fde6f6d4/ford-cuts-prices-of-ev.html,,finance.yahoo
2023-01-30 15:39:00,Ford follows Teslas example and cuts price on Mustang Mach-E,https://finance.yahoo.com/video/ford-follows-tesla-example-cuts-203930366.html,,finance.yahoo
2023-01-30 15:37:00,Ford introduces concierge repair services for participating dealerships,https://finance.yahoo.com/video/ford-introduces-concierge-repair-services-203745465.html,,finance.yahoo
2023-01-30 15:02:00,Why Rivian Stock Plunged Today,https://finance.yahoo.com/m/ea251805-ce86-3d12-ac40-c3ad9607863f/why-rivian-stock-plunged-today.html,,finance.yahoo
2023-01-30 13:10:00,Ford Cuts Mustang Prices. What Does It Mean for Ford Stock?,https://finance.yahoo.com/m/b09ebf10-d51a-3d87-b882-bb1f68d318db/ford-cuts-mustang-prices..html,,finance.yahoo
