Date,Title,Link,Source,source
2023-02-13 17:45:00,Adobe Systems (ADBE) Gains But Lags Market: What You Should Know,https://finance.yahoo.com/news/adobe-systems-adbe-gains-lags-224510314.html,finance.yahoo,
2023-02-13 09:00:00,How to Boost Your Portfolio with Top Computer and Technology Stocks Set to Beat Earnings,https://finance.yahoo.com/news/boost-portfolio-top-computer-technology-140002691.html,finance.yahoo,
2023-02-13 08:50:00,"Artificial Intelligence Stocks To Watch: Big Tech Expands AI Products, Services",https://finance.yahoo.com/m/684c930d-1475-3adc-b013-ae604c056ebc/artificial-intelligence.html,finance.yahoo,
2023-02-12 06:00:00,Investing in Adobe (NASDAQ:ADBE) five years ago would have delivered you a 84% gain,https://finance.yahoo.com/news/investing-adobe-nasdaq-adbe-five-110045932.html,finance.yahoo,
2023-02-08 10:00:00,Adobe and Microsoft Bring Industry-Leading Acrobat PDF Experience to 1.4 Billion Windows Users Through Microsoft Edge,https://finance.yahoo.com/news/adobe-microsoft-bring-industry-leading-150000487.html,finance.yahoo,
2023-02-08 06:01:00,Estimating The Fair Value Of Adobe Inc. (NASDAQ:ADBE),https://finance.yahoo.com/news/estimating-fair-value-adobe-inc-110106326.html,finance.yahoo,
2023-02-06 17:45:00,Adobe Systems (ADBE) Dips More Than Broader Markets: What You Should Know,https://finance.yahoo.com/news/adobe-systems-adbe-dips-more-224510390.html,finance.yahoo,
2023-02-06 07:00:00,Laid-off Silicon Valley workers are panic-selling their start-up shares as valuations plunge  here are 3 top tech stocks for 2023 that actually make money,https://finance.yahoo.com/news/laid-off-silicon-valley-workers-150000073.html,finance.yahoo,
2023-02-04 06:00:00,"Adobe Inc. (NASDAQ:ADBE) insiders sold US$19m worth of stock, possibly signalling a downtrend",https://finance.yahoo.com/news/adobe-inc-nasdaq-adbe-insiders-110012602.html,finance.yahoo,
2023-02-03 08:00:00,2 Cheap Growth Stocks With Exceptional Upside,https://finance.yahoo.com/m/393326d2-ef64-3587-887b-5e17b409c371/2-cheap-growth-stocks-with.html,finance.yahoo,
2023-02-01 19:03:00,Analyst Report: Adobe Inc.,https://finance.yahoo.com/m/4cd76d7b-9d94-3122-b886-ef3547d69d2c/analyst-report%3A-adobe-inc..html,finance.yahoo,
2023-02-01 13:00:00,Adobe Lightroom Brings Professional Photo Editing to Samsung Galaxy S23 Series,https://finance.yahoo.com/news/adobe-lightroom-brings-professional-photo-180000629.html,finance.yahoo,
2023-02-01 06:50:00,Should You Hold Adobe (ADBE) For the Long-Term?,https://finance.yahoo.com/news/hold-adobe-adbe-long-term-115004351.html,finance.yahoo,
2023-01-30 08:01:00,Weekly Stock List,https://finance.yahoo.com/m/21c359a3-7206-3e65-b32d-d9a0ba661d2a/weekly-stock-list.html,finance.yahoo,
2023-01-30 06:01:00,"With 84% ownership of the shares, Adobe Inc. (NASDAQ:ADBE) is heavily dominated by institutional owners",https://finance.yahoo.com/news/84-ownership-shares-adobe-inc-110148882.html,finance.yahoo,
2023-01-26 23:32:00,3 Tech Stocks Getting Ready for a Major Breakout,https://finance.yahoo.com/news/3-tech-stocks-getting-ready-043209809.html,finance.yahoo,
2023-01-26 13:40:00,Adobe to open Atlanta office as company embraces hybrid work,https://finance.yahoo.com/m/3e49afde-af6d-3b62-aff4-26212b26eb18/adobe-to-open-atlanta-office.html,finance.yahoo,
2023-01-26 10:29:00,Morgan Stanley warns Adobes growth is fairly priced into stock,https://finance.yahoo.com/video/morgan-stanley-warns-adobe-growth-152937876.html,finance.yahoo,
2023-01-26 09:00:00,Adobe Inc. (ADBE) is Attracting Investor Attention: Here is What You Should Know,https://finance.yahoo.com/news/adobe-inc-adbe-attracting-investor-140002798.html,finance.yahoo,
2023-01-26 08:00:00,Adobe (NASDAQ:ADBE) Could Easily Take On More Debt,https://finance.yahoo.com/news/adobe-nasdaq-adbe-could-easily-130010728.html,finance.yahoo,
2023-01-20 11:46:00,Adobe Speaks Out on Controversial AI Issue,https://finance.yahoo.com/m/5f06ab47-d945-3e13-833f-c2cd12f27ec1/adobe-speaks-out-on.html,finance.yahoo,
2023-01-20 05:58:00,"3 Stocks Cathie Wood Is Buying That Should Be on Your List, Too",https://finance.yahoo.com/m/068d5a0a-145a-31a0-97f2-f9f64d1d6829/3-stocks-cathie-wood-is.html,finance.yahoo,
2023-01-20 05:17:00,Adobe Full Year 2022 Earnings: In Line With Expectations,https://finance.yahoo.com/news/adobe-full-2022-earnings-line-101720062.html,finance.yahoo,
2023-01-19 09:31:00,DocuSign Stock: Bear vs. Bull,https://finance.yahoo.com/m/1fb6c6a0-5737-311d-ae2a-b3c1f09ad1e7/docusign-stock%3A-bear-vs.-bull.html,finance.yahoo,
2023-01-19 07:48:00,Adobe (ADBE) Witnessed Strong Growth in 2022,https://finance.yahoo.com/news/adobe-adbe-witnessed-strong-growth-124840984.html,finance.yahoo,
2023-01-18 10:34:00,Microsoft Joins Wave of Tech Layoffs as Slowdown Spreads,https://finance.yahoo.com/news/tech-companies-keep-slashing-jobs-004012234.html,finance.yahoo,
2023-01-18 07:00:00,Is Adobe Inc.'s (NASDAQ:ADBE) Latest Stock Performance A Reflection Of Its Financial Health?,https://finance.yahoo.com/news/adobe-inc-nasdaq-adbe-latest-120031441.html,finance.yahoo,
2023-01-18 04:55:00,Adobe Denies Exploiting User Images And Videos For AI Training,https://finance.yahoo.com/news/adobe-denies-exploiting-user-images-095542313.html,finance.yahoo,
2023-01-17 19:58:00,"Adobe, Facing Blowback, Says Customer Data Not Used to Train AI",https://finance.yahoo.com/news/adobe-facing-blowback-says-customer-005827478.html,finance.yahoo,
2023-01-16 19:18:00,The 7 Best Gig Economy Stocks to Buy for 2023,https://finance.yahoo.com/news/7-best-gig-economy-stocks-001855231.html,finance.yahoo,
2023-01-16 15:50:00,3 High-Growth Tech Stocks Set to Soar,https://finance.yahoo.com/news/3-high-growth-tech-stocks-205058090.html,finance.yahoo,
2023-01-16 07:02:00,Should You Exit Adobe (ADBE)?,https://finance.yahoo.com/news/exit-adobe-adbe-120222373.html,finance.yahoo,
2023-01-14 06:01:00,Is It Too Late To Consider Buying Adobe Inc. (NASDAQ:ADBE)?,https://finance.yahoo.com/news/too-consider-buying-adobe-inc-110114301.html,finance.yahoo,
2023-01-13 09:00:00,Adobe Inc. (ADBE) Is a Trending Stock: Facts to Know Before Betting on It,https://finance.yahoo.com/news/adobe-inc-adbe-trending-stock-140002059.html,finance.yahoo,
2023-01-12 05:28:00,Fragile Megacap Tech Stocks Face CPI Test After New Year Rally,https://finance.yahoo.com/news/fragile-megacap-tech-stocks-face-102823668.html,finance.yahoo,
2023-01-11 22:52:00,Adobe Tried to Buy Figma Twice Before $20 Billion Deal,https://finance.yahoo.com/news/adobe-tried-buy-figma-twice-001243026.html,finance.yahoo,
2023-01-10 13:11:00,Cathie Wood Watch: Ark Buys Adobe and Tesla,https://finance.yahoo.com/m/ce2258a0-e290-353b-9e4a-44ba363c0b08/cathie-wood-watch%3A-ark-buys.html,finance.yahoo,
2023-01-10 11:30:00,Cathie Wood Goes Bargain Hunting: 3 Stocks She Just Bought,https://finance.yahoo.com/m/de9580f1-05e3-3184-be04-9a06c64e239a/cathie-wood-goes-bargain.html,finance.yahoo,
2023-01-10 07:56:00,Do You Believe in the Growth Prospects of Adobe (ADBE)?,https://finance.yahoo.com/news/believe-growth-prospects-adobe-adbe-125626928.html,finance.yahoo,
2023-01-10 06:00:00,Adobe's (NASDAQ:ADBE) investors will be pleased with their respectable 78% return over the last five years,https://finance.yahoo.com/news/adobes-nasdaq-adbe-investors-pleased-110054031.html,finance.yahoo,
2023-01-09 16:24:00,Holiday shopping season not expected to save Wall Street as recession worries endure,https://finance.yahoo.com/m/6b64468d-0272-3d39-ab0e-0454e26f8c2c/holiday-shopping-season-not.html,finance.yahoo,
2023-01-09 16:10:00,15 Best Growth Stocks to Buy According to Hedge Funds,https://finance.yahoo.com/news/15-best-growth-stocks-buy-211023529.html,finance.yahoo,
2023-01-09 15:25:00,15 Most Progressive Companies in America,https://finance.yahoo.com/news/15-most-progressive-companies-america-202521760.html,finance.yahoo,
2023-01-09 08:30:00,4 Growth Stocks You'll Wish You Bought On the Dip,https://finance.yahoo.com/m/19de518e-1cdf-3edc-a93a-61f34e5d70a2/4-growth-stocks-you%27ll-wish.html,finance.yahoo,
2023-01-08 10:00:00,Adobes CEO Sizes Up the State of Tech Now,https://finance.yahoo.com/m/5de370e8-05fe-3389-81e8-0dfccfcd8f57/adobe%E2%80%99s-ceo-sizes-up-the.html,finance.yahoo,
2023-01-06 06:01:00,Calculating The Fair Value Of Adobe Inc. (NASDAQ:ADBE),https://finance.yahoo.com/news/calculating-fair-value-adobe-inc-110108384.html,finance.yahoo,
2023-01-06 04:35:00,"The Zacks Analyst Blog Highlights Alphabet, Adobe, TotalEnergies, Novo Nordisk and Diageo",https://finance.yahoo.com/news/zacks-analyst-blog-highlights-alphabet-093509091.html,finance.yahoo,
2023-01-05 13:48:00,"Top Analyst Reports for Alphabet, Novo Nordisk & TotalEnergies",https://finance.yahoo.com/news/top-analyst-reports-alphabet-novo-184806241.html,finance.yahoo,
2023-01-05 11:39:00,Adobe Holiday Tally: Digital Sales Rise 3.5 Percent,https://finance.yahoo.com/m/e401a433-08a8-3cb6-a9ee-b5bf665205d9/adobe-holiday-tally%3A-digital.html,finance.yahoo,
2023-01-05 07:30:00,"Online Holiday Sales Hit a Record as Consumers Keep Spending, Adobe Says",https://finance.yahoo.com/m/72d57798-bbd6-3ea4-ab49-65e237535ba1/online-holiday-sales-hit-a.html,finance.yahoo,
2023-01-03 09:20:00,Software Growth Stocks: Inflation Key To 2023 Outlook,https://finance.yahoo.com/m/5962d59d-fd09-36cb-afa4-1c9b22a80cb4/software-growth-stocks%3A.html,finance.yahoo,
2023-01-03 09:17:00,15 Most Valuable Silicon Valley Companies in the World,https://finance.yahoo.com/news/15-most-valuable-silicon-valley-141713681.html,finance.yahoo,
2023-01-02 14:05:00,Ken Fishers Top 15 Growth Stock Picks,https://finance.yahoo.com/news/ken-fisher-top-15-growth-190500101.html,finance.yahoo,
2023-01-02 11:23:00,"Big Tech will have a better year in 2023, analyst says",https://finance.yahoo.com/news/big-tech-will-have-a-better-year-in-2023-analyst-says-162325718.html,finance.yahoo,
2023-01-02 06:00:00,Possible bearish signals as Adobe Inc. (NASDAQ:ADBE) insiders disposed of US$17m worth of stock,https://finance.yahoo.com/news/possible-bearish-signals-adobe-inc-110024241.html,finance.yahoo,
2023-01-01 08:15:00,Adobe Stock: Bull vs. Bear,https://finance.yahoo.com/m/bca68310-3bf3-3489-b313-ac58a94ab9ac/adobe-stock%3A-bull-vs.-bear.html,finance.yahoo,
2022-12-31 16:01:00,25 Tech Stocks to Buy Before They Take Off in 2023,https://finance.yahoo.com/news/25-tech-stocks-buy-off-210149756.html,finance.yahoo,
2022-12-30 13:30:00,15 Best 52-Week Low Large Cap Stocks to Buy Now,https://finance.yahoo.com/news/15-best-52-week-low-183029328.html,finance.yahoo,
2022-12-30 09:14:00,"Down 40% in 2022, Is Adobe Stock a Buy for 2023?",https://finance.yahoo.com/m/730db16d-880b-353c-b653-4316bd494ac4/down-40%25-in-2022%2C-is-adobe.html,finance.yahoo,
2022-12-29 16:58:00,3 Great Stocks to Buy in 2023 and Hold Forever,https://finance.yahoo.com/news/3-great-stocks-buy-2023-215809371.html,finance.yahoo,
2022-12-29 09:00:00,"Down 42% in 2022, Is Adobe a No-Brainer Stock in 2023 and Beyond?",https://finance.yahoo.com/m/cee44f4d-11eb-3e9b-9564-3983934ae520/down-42%25-in-2022%2C-is-adobe-a.html,finance.yahoo,
2022-12-29 06:00:00,Adobe Inc. (NASDAQ:ADBE) is favoured by institutional owners who hold 83% of the company,https://finance.yahoo.com/news/adobe-inc-nasdaq-adbe-favoured-110026563.html,finance.yahoo,
2022-12-28 16:07:00,The 7 Biggest Opportunities for Stock Investors in 2023,https://finance.yahoo.com/news/7-biggest-opportunities-stock-investors-210744361.html,finance.yahoo,
2022-12-28 12:53:00,Figma Acquisition News Hurt Adobe (ADBE) Stock in Q3,https://finance.yahoo.com/news/figma-acquisition-news-hurt-adobe-175311746.html,finance.yahoo,
2022-12-28 06:54:00,"3 Things to Love About Adobe, Even Though Its Stock Is Down 40%",https://finance.yahoo.com/m/f14090aa-f872-3b82-8881-12f12ea98ecb/3-things-to-love-about-adobe%2C.html,finance.yahoo,
2022-12-27 07:00:00,2 Unstoppable Stocks That Could Make a Comeback in 2023,https://finance.yahoo.com/m/aeae068b-d0fe-3491-b2d2-fcd9cd936292/2-unstoppable-stocks-that.html,finance.yahoo,
2022-12-26 09:37:00,"Rivian Stock Is Down 80% From Its High, but It's No Bargain",https://finance.yahoo.com/m/10420a94-b806-318d-9b83-71d2b53d4a4b/rivian-stock-is-down-80%25-from.html,finance.yahoo,
2022-12-25 06:00:00,What You Can Learn From Adobe Inc.'s (NASDAQ:ADBE) P/E,https://finance.yahoo.com/news/learn-adobe-inc-nasdaq-adbe-110027002.html,finance.yahoo,
2022-12-22 16:39:00,3 Tech Stocks With Favorable Growth Outlooks,https://finance.yahoo.com/news/3-tech-stocks-favorable-growth-213909584.html,finance.yahoo,
2022-12-22 14:27:00,Jim Cramers 10 Comeback Stocks,https://finance.yahoo.com/news/jim-cramer-10-comeback-stocks-192700208.html,finance.yahoo,
2022-12-22 09:07:00,Is Adobe Stock a Buy Now?,https://finance.yahoo.com/m/05ee0133-9b95-3982-8983-62807732675e/is-adobe-stock-a-buy-now%3F.html,finance.yahoo,
2022-12-22 07:00:00,Corporate Tech Leaders Untangle Their Cybersecurity Roles,https://finance.yahoo.com/m/030dea5c-c082-3a4a-bfa3-167b8996dfd8/corporate-tech-leaders.html,finance.yahoo,
2022-12-22 05:31:00,These 2 No-Brainer Stocks Are Leading the Market This Quarter. Can You Still Buy?,https://finance.yahoo.com/m/789a275e-2f07-35e7-8f39-97e0178cc964/these-2-no-brainer-stocks-are.html,finance.yahoo,
2022-12-21 23:07:00,Adobe Inc. (NASDAQ:ADBE) Q4 2022 Earnings Call Transcript,https://finance.yahoo.com/news/adobe-inc-nasdaq-adbe-q4-040710466.html,finance.yahoo,
2022-12-21 16:23:00,7 Top Stock Ideas for 2023,https://finance.yahoo.com/news/7-top-stock-ideas-2023-212324748.html,finance.yahoo,
2022-12-21 11:46:00,Should You Consider Selling Adobe (ADBE) on the News of Figma Acquisition?,https://finance.yahoo.com/news/consider-selling-adobe-adbe-news-164612621.html,finance.yahoo,
2022-12-21 11:00:00,3 Green Flags for Adobe's Future,https://finance.yahoo.com/m/f6b25296-01e7-38ca-a9bc-c5c5eff4e67c/3-green-flags-for-adobe%27s.html,finance.yahoo,
2022-12-21 07:15:00,"Disney, Oracle and Adobe: Our lukewarm take on recent news and earnings",https://finance.yahoo.com/news/disney-oracle-adobe-lukewarm-recent-121521494.html,finance.yahoo,
2022-12-21 06:46:00,Daily  Vickers Top Buyers & Sellers for 12/21/2022,https://finance.yahoo.com/m/9eb9f418-341f-33f5-8bd7-6ccc8110d1f7/daily-%E2%80%93-vickers-top-buyers-%26.html,finance.yahoo,
2022-12-20 07:12:00,Analyst Report: Adobe Inc,https://finance.yahoo.com/m/dde15b9c-08e0-3a7e-8de1-438f432b2926/analyst-report%3A-adobe-inc.html,finance.yahoo,
2022-12-20 06:57:00,"Market Digest: ADBE, JBL, QSR",https://finance.yahoo.com/m/00c68045-1259-3651-bd0c-514a41aeea1f/market-digest%3A-adbe%2C-jbl%2C-qsr.html,finance.yahoo,
2022-12-20 05:07:00,"2 Growth Stocks That Can Turn $500,000 Into $1 Million by 2025",https://finance.yahoo.com/m/68a2d7de-5a41-3051-9d68-35392b4e963d/2-growth-stocks-that-can-turn.html,finance.yahoo,
2022-12-19 09:24:00,"Company News for Dec 19, 2022",https://finance.yahoo.com/news/company-news-dec-19-2022-142402552.html,finance.yahoo,
2022-12-19 08:32:00,Adobe Management Buys 5 Million Shares of Adobe Stock: Does That Mean You Should Buy Too?,https://finance.yahoo.com/m/e366b12c-8352-3dbd-8631-f670e9318364/adobe-management-buys-5.html,finance.yahoo,
2022-12-19 06:00:00,Are Robust Financials Driving The Recent Rally In Adobe Inc.'s (NASDAQ:ADBE) Stock?,https://finance.yahoo.com/news/robust-financials-driving-recent-rally-110026024.html,finance.yahoo,
2022-12-18 07:40:00,Should You Buy Adobe Stock to Kick Off 2023?,https://finance.yahoo.com/m/2e9c7ccb-389c-3f87-8ddc-a4812c979812/should-you-buy-adobe-stock-to.html,finance.yahoo,
2022-12-17 09:03:00,Adobe Stock: Bear vs. Bull,https://finance.yahoo.com/m/09743fc5-f011-39e0-acbb-b2d944318eb2/adobe-stock%3A-bear-vs.-bull.html,finance.yahoo,
2022-12-16 16:21:00,"Maxar, Guardant Health, Faraday, and More Stock Market Movers Today",https://finance.yahoo.com/m/43530659-ddda-3dd3-b9dd-585925e8da8b/maxar%2C-guardant-health%2C.html,finance.yahoo,
2022-12-16 16:12:00,Adobe Clears Some of Its Cloud,https://finance.yahoo.com/m/b40a7fbd-c50a-3463-89f1-7d2ea8763981/adobe-clears-some-of-its-cloud.html,finance.yahoo,
2022-12-16 13:39:00,Adobe Stock Hits Resistance on Earnings Rally. Here's the Trade.,https://finance.yahoo.com/m/d9aa6d48-e1de-3078-b063-c7627898435b/adobe-stock-hits-resistance.html,finance.yahoo,
2022-12-16 12:51:00,Why Adobe Stock Popped on Friday,https://finance.yahoo.com/m/69bc27a8-512b-3851-b483-b6feffe6f24c/why-adobe-stock-popped-on.html,finance.yahoo,
2022-12-16 12:02:00,"Adobe (ADBE) Q4 Earnings & Revenues Beat Estimates, Rise Y/Y",https://finance.yahoo.com/news/adobe-adbe-q4-earnings-revenues-170205878.html,finance.yahoo,
2022-12-16 10:45:00,Here's How to Trade Adobe After a Post-Earnings Spike,https://finance.yahoo.com/m/8662cdb8-1ae4-3661-80fc-0b57153cf49a/here%27s-how-to-trade-adobe.html,finance.yahoo,
2022-12-16 10:24:00,"Adobe stock jumps on earnings beat, optimism on Figma buy",https://finance.yahoo.com/m/06160b9d-ea61-36e4-96d3-15f5b0a2a91a/adobe-stock-jumps-on-earnings.html,finance.yahoo,
2022-12-16 10:14:00,"Stocks: Meta rises, Adobe surges, real estate lags",https://finance.yahoo.com/video/stocks-meta-rises-adobe-surges-151403110.html,finance.yahoo,
2022-12-16 09:45:00,These 3 Stocks Could Potentially Be 2023's Biggest Winners,https://www.fool.com/investing/2022/12/16/these-3-stocks-could-potentially-be-2023s-biggest/?source=eptyholnk0000202&utm_source=yahoo-host&utm_medium=feed&utm_campaign=article,www.fool,
2022-12-16 09:44:00,"Adobe beats on earnings, but analyst warns of risk to guidance",https://finance.yahoo.com/video/adobe-beats-earnings-analyst-warns-144402240.html,finance.yahoo,
2022-12-16 08:42:00,"Adobe Rises, but This Stock Is Friday's Big Winner",https://www.fool.com/investing/2022/12/16/adobe-rises-but-this-stock-is-fridays-big-winner/?source=eptyholnk0000202&utm_source=yahoo-host&utm_medium=feed&utm_campaign=article,www.fool,
2022-12-16 08:21:00,"Dow Jones Futures Fall After Nasdaq Breaks Key Level, Apple Dives; Here's The Silver Lining",https://www.investors.com/market-trend/stock-market-today/dow-jones-futures-nasdaq-breaks-key-level-apple-dives-here-is-the-silver-lining/?src=A00220,www.investors,
2022-12-16 05:55:00,"The Zacks Analyst Blog Highlights Adobe, Salesforce, Lowe's, UDR and Las Vegas Sands",https://finance.yahoo.com/news/zacks-analyst-blog-highlights-adobe-105510315.html,finance.yahoo,
2022-12-16 02:57:00,"Adobe, Darden Restaurants, Meta Platforms rise premarket; General Motors falls",https://finance.yahoo.com/news/adobe-darden-restaurants-meta-platforms-075735959.html,finance.yahoo,
2022-12-16 02:00:00,"ECB warnings, Mazars' Binance u-turn, Adobe strength - what's moving markets",https://finance.yahoo.com/news/ecb-warnings-mazars-binance-u-070037875.html,finance.yahoo,
2022-12-15 18:49:00,Adobe Stock Rallies on Earnings. Management Sticks With Forecasts.,https://www.barrons.com/articles/adobe-stock-earnings-guidance-51671141813?siteid=yhoof2,www.barrons,
2023-01-22 10:00:00,Laid-off Silicon Valley workers are panic-selling their start-up shares as valuations plummet  here are 3 top tech stocks for 2023 that actually make money,https://finance.yahoo.com/news/laid-off-silicon-valley-workers-150000073.html,,finance.yahoo
2022-12-15 17:50:00,2023 Shaping Up to Be a Consequential Year,https://finance.yahoo.com/news/2023-shaping-consequential-225010239.html,,finance.yahoo
2022-12-15 17:29:00,Adobe Fourth-Quarter Revenues Up 10% as Demand Remains Strong,https://www.wsj.com/articles/adobe-fourth-quarter-revenues-up-10-as-demand-remains-strong-11671143327?siteid=yhoof2,,www.wsj
2022-12-15 17:25:00,Adobe Systems (ADBE) Beats Q4 Earnings and Revenue Estimates,https://finance.yahoo.com/news/adobe-systems-adbe-beats-q4-222510077.html,,finance.yahoo
