Date,Title,Source,Link
2023-02-14 12:23:00,"Stocks making the biggest moves midday: Palantir, Nvidia, Avis Budget and more",www.cnbc.com,https://www.cnbc.com/2023/02/14/stocks-moving-big-midday-pltr-nvda-car.html
2023-02-14 12:08:00,Boeing will sell over 200 planes to Air India in ‘historic agreement’,foxbusiness.com,https://foxbusiness.com/markets/boeing-sell-200-planes-air-india-historic-agreement
2023-02-14 11:47:00,Brookfield Defaults on Two Los Angeles Office Towers,www.bloomberg.com,https://www.bloomberg.com/news/articles/2023-02-14/brookfield-defaults-on-two-los-angeles-office-towers?srnd=markets-vp
2023-02-14 11:42:00,Billionaire Deripaska Challenges Scope of EU Sanctions on Russia,www.bloomberg.com,https://www.bloomberg.com/news/articles/2023-02-14/billionaire-deripaska-challenges-scope-of-eu-sanctions-on-russia?srnd=markets-vp
2023-02-14 11:29:00,Air India in record order for new planes,www.bbc.co.uk,https://www.bbc.co.uk/news/business-64639663?at_medium=RSS&at_campaign=KARANGA
2023-02-14 11:26:00,Inflation Brings Back the Heat,www.wsj.com,https://www.wsj.com/articles/inflation-brings-back-the-heat-4c80c9be?mod=rss_markets_main
2023-02-14 11:08:00,Vanguard to Liquidate a Mutual Fund for First Time Since 2020,www.bloomberg.com,https://www.bloomberg.com/news/articles/2023-02-14/vanguard-to-liquidate-a-mutual-fund-for-first-time-since-2020?srnd=markets-vp
2023-02-14 11:00:00,Subway Confirms It's Seeking Buyers,www.wsj.com,https://www.wsj.com/articles/subway-confirms-it-is-seeking-buyers-419dc974?mod=rss_markets_main
2023-02-14 10:40:00,A Dozen Eggs Now Costs More Than a Pound of Ground Beef,www.bloomberg.com,https://www.bloomberg.com/news/articles/2023-02-14/a-dozen-eggs-now-costs-more-than-a-pound-of-ground-beef-chart?srnd=markets-vp
2023-02-14 10:29:00,"Adani Gets a Reprieve, Courtesy of the Black Stuff",www.wsj.com,https://www.wsj.com/articles/adani-gets-a-reprieve-courtesy-of-the-black-stuff-26926033?mod=rss_markets_main
2023-02-14 10:27:00,Remote work costs NYC over $12B annually: report,foxbusiness.com,https://foxbusiness.com/economy/remote-work-costs-nyc-over-12b-annually
2023-02-14 09:59:00,"Inflation Cooled Just Slightly, With Worrying Details",www.nytimes.com,https://www.nytimes.com/2023/02/14/business/economy/january-cpi-inflation-report.html
2023-02-14 09:54:00,Goldman Sachs CEO says odds of a 'softer landing' for U.S. economy have improved,www.cnbc.com,https://www.cnbc.com/2023/02/14/goldman-sachs-ceo-david-solomon-on-soft-landing-odds-for-us-economy-.html
2023-02-14 09:53:00,Triton to Weigh Sale of Former VW Gearbox Maker Renk,www.bloomberg.com,https://www.bloomberg.com/news/articles/2023-02-14/triton-is-said-to-weigh-sale-of-former-vw-gearbox-maker-renk?srnd=markets-vp
2023-02-14 09:52:00,Germany Pushes Energy Security With Second Belgium Power Link,www.bloomberg.com,https://www.bloomberg.com/news/articles/2023-02-14/germany-pushes-energy-security-with-second-belgium-power-link?srnd=markets-vp
2023-02-14 09:45:00,Israel Exports Oil for First Time With Cargo Heading to Europe,www.bloomberg.com,https://www.bloomberg.com/news/articles/2023-02-14/israel-exports-oil-for-first-time-with-cargo-heading-to-europe?srnd=markets-vp
2023-02-14 09:42:00,U.S. FDA declines to review Soligenix's cancer drug; shares sink,www.reuters.com,https://www.reuters.com/business/healthcare-pharmaceuticals/us-fda-declines-review-soligenixs-cancer-drug-2023-02-14/
2023-02-14 09:32:00,At North Sea Field a Scoreboard Tracks Norway’s Rising Oil Clout,www.bloomberg.com,https://www.bloomberg.com/news/articles/2023-02-14/at-north-sea-field-a-scoreboard-tracks-norway-s-rising-oil-clout?srnd=markets-vp
2023-02-14 09:30:00,"Ford cutting 3,800 European jobs in EV push",foxbusiness.com,https://foxbusiness.com/markets/ford-cutting-3800-european-jobs-ev-push
2023-02-14 09:25:00,Gen. David Petraeus: How the war in Ukraine will end,www.cnn.com,https://www.cnn.com/2023/02/14/opinions/petraeus-how-ukraine-war-ends-bergen-ctpr/index.html
2023-02-14 09:22:00,Princeton economist warns Biden’s tax on stock buybacks will hurt your 401(k),foxbusiness.com,https://foxbusiness.com/economy/princeton-economist-warns-bidens-tax-stock-buybacks-401k
2023-02-14 09:05:00,Most Gulf bourses fall on weak corporate earnings; Abu Dhabi gains,www.reuters.com,https://www.reuters.com/world/middle-east/most-gulf-bourses-fall-weak-corporate-earnings-abu-dhabi-gains-2023-02-14/
2023-02-14 09:02:00,Consumer prices rose 6.4% in January,foxbusiness.com,https://foxbusiness.com/economy/consumer-prices-inflation-rose-january
2023-02-14 09:01:00,Loans firm Amigo let off £73m fine,www.bbc.co.uk,https://www.bbc.co.uk/news/business-64639550?at_medium=RSS&at_campaign=KARANGA
2023-02-14 09:00:00,IMF Chief Sees ‘Very Good Progress’ From Tunisia on Loan Program,www.bloomberg.com,https://www.bloomberg.com/news/articles/2023-02-14/imf-chief-sees-very-good-progress-from-tunisia-on-loan-program?srnd=markets-vp
2023-02-14 08:46:00,Diamond Tycoon Jatin Mehta Fails to Halt Banks’ $1 Billion Chase Through UK Courts,www.bloomberg.com,https://www.bloomberg.com/news/articles/2023-02-14/diamond-tycoon-jatin-mehta-fails-to-halt-lenders-1-billion-uk-court-chase?srnd=markets-vp
2023-02-14 08:44:00,U.S. consumer prices increase in January; trend slowing,www.reuters.com,https://www.reuters.com/markets/us/us-consumer-prices-increase-january-trend-slowing-2023-02-14/
2023-02-14 08:44:00,Inflation Tracker: When Will Prices Stop Going Up?,www.wsj.com,https://www.wsj.com/articles/inflation-tracker-cpi-data-prices-11657717467?mod=rss_markets_main
2023-02-14 08:41:00,OPEC Expects Stronger Economies to Boost Oil Demand,www.wsj.com,https://www.wsj.com/articles/opec-expects-stronger-economies-to-boost-oil-demand-a95e22a5?mod=rss_markets_main
2023-02-14 08:35:00,British Columbia’s Investment Manager Piles Into Private Credit,www.bloomberg.com,https://www.bloomberg.com/news/articles/2023-02-14/british-columbia-s-investment-manager-piles-into-private-credit?srnd=markets-vp
2023-02-14 08:26:00,Saudi Arabia’s SNB Capital Sees 2023 as M&A Year After IPO Boom,www.bloomberg.com,https://www.bloomberg.com/news/articles/2023-02-14/saudi-arabia-s-snb-capital-sees-2023-as-m-a-year-after-ipo-boom?srnd=markets-vp
2023-02-14 08:22:00,"Dollar slips with inflation in focus; euro, sterling up on jobs data",www.reuters.com,https://www.reuters.com/markets/currencies/dollar-eases-inflation-focus-boj-governor-nomination-awaited-2023-02-14/
2023-02-14 08:14:00,"OPEC Sees Oil Market a Bit Tighter on More Demand, Less Supply",www.bloomberg.com,https://www.bloomberg.com/news/articles/2023-02-14/opec-sees-oil-market-a-bit-tighter-on-more-demand-less-supply?srnd=markets-vp
2023-02-14 08:12:00,Fund managers gradually move away from cash and towards stocks - BofA survey,www.reuters.com,https://www.reuters.com/markets/global-markets-bofasurvey-urgent-2023-02-14/
2023-02-13 21:44:00,Indian shares set to rise ahead of U.S. inflation data,www.reuters.com,https://www.reuters.com/world/india/indian-shares-set-rise-ahead-us-inflation-data-2023-02-14/
2023-02-13 21:41:00,Ueda Likely to Keep BOJ Policy Accommodative: Fmr. Assistant Governor,www.bloomberg.com,https://www.bloomberg.com/news/videos/2023-02-14/ueda-likely-to-keep-boj-policy-accommodative-fmr-assistant-governor?srnd=markets-vp
2023-02-13 21:36:00,Asian Stocks Rise Ahead of CPI; Yen Gains on BOJ: Markets Wrap,www.bloomberg.com,https://www.bloomberg.com/news/articles/2023-02-13/stocks-poised-to-extend-gains-in-asia-ahead-of-cpi-markets-wrap
2023-02-13 21:28:00,A Surprise Pick to Lead the Bank of Japan Faces a Wrenching Choice,www.nytimes.com,https://www.nytimes.com/2023/02/13/business/bank-of-japan-kazuo-ueda.html
2023-02-13 21:27:00,Hong Kong’s Lee Defends Adding Security Clause to Land Auctions,www.bloomberg.com,https://www.bloomberg.com/news/articles/2023-02-14/hong-kong-s-lee-defends-adding-security-clause-to-land-auctions?srnd=markets-vp
2023-02-13 21:16:00,"Stocks moving in after-hours: Palantir, Avis, Denny's",finance.yahoo.com,https://finance.yahoo.com/news/stocks-moving-in-after-hours-palantir-avis-dennys-222243747.html
2023-02-13 21:03:00,China’s Economic Bonanza From Record Trade Surplus Is Fading,www.bloomberg.com,https://www.bloomberg.com/news/articles/2023-02-14/china-s-economic-bonanza-from-record-trade-surplus-is-fading?srnd=markets-vp
2023-02-13 21:01:00,"Asian Shares track Wall Street's inflation optimism, yen recoups losses",www.reuters.com,https://www.reuters.com/markets/global-markets-wrapup-1-pix-2023-02-14/
2023-02-13 20:55:00,Brazil Central Bank Chief Pledges to Work With Lula’s Government,www.bloomberg.com,https://www.bloomberg.com/news/articles/2023-02-14/brazil-central-bank-chief-pledges-to-work-with-lula-s-government?srnd=markets-vp
2023-02-13 20:46:00,Star Entertainment shares extend fall on impairment charge warning,www.reuters.com,https://www.reuters.com/business/star-entertainment-shares-extend-fall-impairment-charge-warning-2023-02-14/
2023-02-13 20:40:00,GOP lawmakers probe timing of FTX founder Sam Bankman-Fried's arrest,foxbusiness.com,https://foxbusiness.com/politics/gop-lawmakers-probe-timing-ftx-founder-sam-bankman-frieds-arrest
2023-02-13 20:25:00,'Fed is not your friend': Wells Fargo delivers warning ahead of key inflation report,www.cnbc.com,https://www.cnbc.com/2023/02/13/wells-fargos-warning-ahead-of-cpi-report-fed-is-not-your-friend.html
2023-02-13 20:11:00,Fallout of Crypto Stablecoin Regulation Spills Over to Decentralized Finance Sector,www.bloomberg.com,https://www.bloomberg.com/news/articles/2023-02-14/fallout-of-crypto-stablecoin-regulation-spills-over-to-decentralized-finance?srnd=markets-vp
2023-02-13 19:29:00,Ex-Private Equity Chief for Joe Tsai’s Family Office Starts Fund,www.bloomberg.com,https://www.bloomberg.com/news/articles/2023-02-14/ex-private-equity-chief-for-joe-tsai-s-family-office-starts-fund?srnd=markets-vp
2023-02-13 19:18:00,FIS's Worldpay Spinoff Is Jumbled by Tough Outlook,www.wsj.com,https://www.wsj.com/articles/fiss-worldpay-spinoff-is-jumbled-by-tough-outlook-779d633a?mod=rss_markets_main
2023-02-13 19:03:00,Six tips for getting a job if you're over 50,www.bbc.co.uk,https://www.bbc.co.uk/news/business-64625372?at_medium=RSS&at_campaign=KARANGA
2023-02-13 19:00:00,Japan Economy Picks Up in Some Reassurance for New BOJ Governor,www.bloomberg.com,https://www.bloomberg.com/news/articles/2023-02-14/japan-economy-picks-up-in-some-reassurance-for-new-boj-governor?srnd=markets-vp
2023-02-13 18:51:00,Crypto Investors Brace for More Crackdowns From Regulators,www.wsj.com,https://www.wsj.com/articles/crypto-investors-brace-for-more-crackdowns-from-regulators-c1507134?mod=rss_markets_main
2023-02-13 18:49:00,New SEC rules target corporate insider trading,foxbusiness.com,https://foxbusiness.com/markets/sec-rules-target-corporate-insider-trading
2023-02-13 18:40:00,Ueda Set for Central Bank Nomination as a BOJ-Favored ‘Outsider’,www.bloomberg.com,https://www.bloomberg.com/news/articles/2023-02-13/ueda-set-for-central-bank-nomination-as-a-boj-favored-outsider?srnd=markets-vp
2023-02-13 18:40:00,Crypto Crackdown Puts Binance-Linked Stablecoin in Crosshairs,www.bloomberg.com,https://www.bloomberg.com/news/videos/2023-02-13/crypto-crackdown-puts-binance-linked-stablecoin-in-crosshairs?srnd=markets-vp
2023-02-13 18:30:00,Chuck Schumer says US TikTok ban 'should be looked at',foxbusiness.com,https://foxbusiness.com/politics/chuck-schumer-tiktok-ban-looked-at
2023-02-13 18:30:00,"Dabur Weighs Acquisitions to Expand Across India, Southeast Asia",www.bloomberg.com,https://www.bloomberg.com/news/articles/2023-02-13/dabur-mulls-acquisitions-to-expand-across-india-southeast-asia?srnd=markets-vp
2023-02-13 18:16:00,Dow Climbs 377 Points Ahead of Inflation Report,www.wsj.com,https://www.wsj.com/articles/global-stocks-markets-dow-update-02-13-2023-d7510c42
2023-02-13 18:00:00,Cyclone Gabrielle lashes Auckland as nationwide state of emergency ordered,www.cnn.com,https://www.cnn.com/2023/02/11/asia/new-zealand-cyclone-auckland-gabrielle-intl-hnk/index.html
2023-02-13 17:56:00,Stocks Poised to Extend Gains in Asia Ahead of CPI: Markets Wrap,www.bloomberg.com,https://www.bloomberg.com/news/articles/2023-02-13/stocks-poised-to-extend-gains-in-asia-ahead-of-cpi-markets-wrap?srnd=markets-vp
2023-02-13 17:53:00,Biden to sell 26 million barrels more from the Strategic Petroleum Reserve,foxbusiness.com,https://foxbusiness.com/politics/biden-sell-26-million-barrels-more-strategic-petroleum-reserve
2023-02-13 17:49:00,Ford to build battery plant in Michigan in drive with Chinese tech partner,www.reuters.com,https://www.reuters.com/technology/ford-invest-35-billion-build-michigan-battery-plant-2023-02-13/
2023-02-13 17:48:00,"IMF to Meet With China, India, Paris Club on Debt Relief Friday",www.bloomberg.com,https://www.bloomberg.com/news/articles/2023-02-13/imf-to-meet-with-china-india-paris-club-on-debt-relief-friday?srnd=markets-vp
2023-02-13 17:34:00,"Hong Kong Dollar Hits Weak End of Band, HKMA Intervenes For First Time Since November",www.bloomberg.com,https://www.bloomberg.com/news/articles/2023-02-13/hong-kong-dollar-hits-weak-end-of-band-hkma-s-first-intervention-since-november?srnd=markets-vp
2023-02-13 17:11:00,Lilt drink brand to be scrapped after 50 years and rebranded,www.bbc.co.uk,https://www.bbc.co.uk/news/business-64629080?at_medium=RSS&at_campaign=KARANGA
2023-02-13 16:54:00,ASIA Japanese and Indian appetizers,www.reuters.com,https://www.reuters.com/markets/global-markets-view-asia-graphic-pix-2023-02-13/
2023-02-13 16:50:00,: Usana names new CEO,www.marketwatch.com,http://www.marketwatch.com/news/story/usana-names-new-ceo/story.aspx?guid={20C06575-04D4-B545-7198-895CE24BC22C}&siteid=rss
2023-02-13 16:49:00,"Stocks making the biggest moves after hours: Avis, Palantir, Cadence Design and more",www.cnbc.com,https://www.cnbc.com/2023/02/13/stocks-moving-big-after-hours-car-pltr-anet-sedg.html
2023-02-13 16:44:00,Brazil's Carrefour Brasil posts 28% drop in Q4 adjusted net profit,www.reuters.com,https://www.reuters.com/business/retail-consumer/brazils-carrefour-brasil-posts-28-drop-q4-adjusted-net-profit-2023-02-13/
2023-02-13 16:34:00,"Palantir expects 2023 to be first profitable year, sees AI driving growth",www.reuters.com,https://www.reuters.com/technology/palantir-expects-2023-be-first-profitable-year-sees-ai-driving-growth-2023-02-13/
2023-02-13 16:23:00,Law firms turn to layoffs amid slowing demand,foxbusiness.com,https://foxbusiness.com/economy/law-firms-layoffs-amid-slowing-demand
2023-02-13 16:21:00,Why January’s inflation report could deal a massive blow to the stock market,www.marketwatch.com,https://www.marketwatch.com/story/why-januarys-cpi-report-could-deal-a-massive-blow-to-the-stock-market-296cfe28
2023-02-13 16:17:00,Collecting Pharma's Scraps Can Pay Off for This Biotech,www.wsj.com,https://www.wsj.com/articles/collecting-pharmas-scraps-can-pay-off-for-this-biotech-40a95249?mod=rss_markets_main
2023-02-13 16:15:00,": Arista Networks’ stock is up 3.5% on strong results, revenue guidance",www.marketwatch.com,http://www.marketwatch.com/news/story/arista-networks-stock-up-35/story.aspx?guid={20C06575-04D4-B545-7198-7CC0BBE3E917}&siteid=rss
2023-02-13 16:08:00,CPI Will Show Whether Stocks or Bonds Got It Right,www.bloomberg.com,https://www.bloomberg.com/news/articles/2023-02-13/stock-bulls-about-to-find-out-if-break-with-bonds-was-good-idea?srnd=markets-vp
2023-02-13 16:06:00,U.S. stocks end sharply higher ahead of highly-anticipated CPI data on January inflation,www.marketwatch.com,http://www.marketwatch.com/news/story/us-stocks-end-sharply-higher/story.aspx?guid={80740B3D-DF4C-4A34-ADBB-708586CC7EAC}&siteid=rss
2023-02-13 16:00:00,Singapore Tackling High Cost of Living Seen as Top Budget Goal,www.bloomberg.com,https://www.bloomberg.com/news/articles/2023-02-13/singapore-tackling-high-cost-of-living-seen-as-top-budget-goal?srnd=markets-vp
2023-02-13 16:00:00,Tokyo Condo Market Shows Early Cooling Signs on BOJ Policy Risks,www.bloomberg.com,https://www.bloomberg.com/news/articles/2023-02-13/tokyo-condo-market-shows-early-cooling-signs-on-boj-policy-risks?srnd=markets-vp
2023-02-13 15:47:00,Turkey Plans Tax Waiver for Share Buybacks on Stock Exchange After Trading Halt,www.bloomberg.com,https://www.bloomberg.com/news/articles/2023-02-13/turkey-plans-tax-waiver-for-share-buybacks-on-stock-exchange-after-trading-halt?srnd=markets-vp
2023-02-13 15:36:00,Barney franchise is back: Mattel says it's doing a 'comprehensive revitalization',foxbusiness.com,https://foxbusiness.com/lifestyle/barney-franchise-mattel-doing-comprehensive-revitalization
2023-02-13 15:21:00,JPMorgan’s Kolanovic Urges Investors to Ditch Stocks for Bonds,www.bloomberg.com,https://www.bloomberg.com/news/articles/2023-02-13/jpmorgan-s-kolanovic-urges-investors-to-ditch-stocks-for-bonds-le39h7qf?srnd=markets-vp
2023-02-13 15:16:00,Architect of the Capitol Blanton fired after IG report finds misconduct,www.marketwatch.com,http://www.marketwatch.com/news/story/architect-capitol-blanton-fired-after/story.aspx?guid={F953A55B-61AF-435C-A418-6C5A8573AEA3}&siteid=rss
2023-02-13 15:11:00,"US cutting ties with China 'easier said than done,' experts warn",foxbusiness.com,https://foxbusiness.com/politics/us-cutting-ties-china-easier-done-experts-warn
2023-02-13 14:57:00,How Citigroup Helped Lift the Lid on Trafigura’s Nickel Nightmare,www.bloomberg.com,https://www.bloomberg.com/news/articles/2023-02-13/trafigura-s-nickel-nightmare-how-citigroup-helped-lift-the-lid?srnd=markets-vp
2023-02-13 14:44:00,: U.S. oil futures end at a more than 2-week high,www.marketwatch.com,http://www.marketwatch.com/news/story/us-oil-futures-end-more/story.aspx?guid={20C06575-04D4-B545-7198-57C96A72121A}&siteid=rss
2023-02-13 14:24:00,Adani hires Grant Thornton for some independent audits after Hindenburg fallout -sources,www.reuters.com,https://www.reuters.com/world/india/adani-hires-grant-thornton-some-independent-audits-after-hindenburg-fallout-2023-02-13/
2023-02-13 14:06:00,Fed governor: Interest rates will likely 'continue to increase' to reach inflation goal,foxbusiness.com,https://foxbusiness.com/politics/fed-governor-interest-rates-likely-continue-increase-reach-inflation-goal
2023-02-13 14:04:00,"Saipem shares drop, group says cannot explain why",www.reuters.com,https://www.reuters.com/markets/commodities/saipem-shares-drop-group-says-cannot-explain-why-2023-02-13/
2023-02-13 13:46:00,Ford Will Build a U.S. Battery Factory With Technology From China,www.nytimes.com,https://www.nytimes.com/2023/02/13/business/energy-environment/ford-catl-electric-vehicle-battery.html
2023-02-13 13:46:00,: Gold futures settle at a 5-week low,www.marketwatch.com,http://www.marketwatch.com/news/story/gold-futures-settle-5-week-low/story.aspx?guid={20C06575-04D4-B545-7198-3DF78E671AF9}&siteid=rss
2023-02-13 13:30:00,Wall Street’s Mutual Fund-to-ETF Magic Trick Is Failing to Wow,www.bloomberg.com,https://www.bloomberg.com/news/articles/2023-02-13/mutual-fund-to-etf-conversions-failed-to-attract-investors-in-2022?srnd=markets-vp
2023-02-13 13:05:00,Biotech Went Through Its IPO Boom. Now the Shakeout Is Underway,www.bloomberg.com,https://www.bloomberg.com/news/articles/2023-02-13/biotech-went-through-its-ipo-boom-now-the-shakeout-is-underway?srnd=markets-vp
2023-02-13 13:00:00,"Financial secrecy among biggest red flags in a partner, Wells Fargo says",foxbusiness.com,https://foxbusiness.com/lifestyle/financial-secrecy-among-biggest-red-flags-partner-wells-fargo-says
2023-02-13 12:57:00,BlackRock cuts Japanese stocks to \,www.reuters.com,https://www.reuters.com/markets/asia/blackrock-cuts-japanese-stocks-underweight-hawkish-boj-risks-2023-02-13/
2023-02-13 12:53:00,: Meta Chief Business Officer Levine to leave,www.marketwatch.com,http://www.marketwatch.com/news/story/meta-chief-business-officer-levine/story.aspx?guid={20C06575-04D4-B545-7198-22F13A40C5F5}&siteid=rss
2023-02-13 12:38:00,"Bear Market Is Over in Stocks, Wells Fargo’s Chris Harvey Says",www.bloomberg.com,https://www.bloomberg.com/news/articles/2023-02-13/wells-fargo-s-chris-harvey-says-bear-market-is-over-in-stocks?srnd=markets-vp
2023-02-13 12:32:00,The latest on the unidentified objects shot down in North American airspace,edition.cnn.com,https://edition.cnn.com/webview/politics/live-news/unidentified-objects-us-airspace-white-house-02-13-2023/index.html
2023-02-13 12:30:00,"Stocks making the biggest moves midday: Zillow, Microsoft, Meta, Fidelity National and more",www.cnbc.com,https://www.cnbc.com/2023/02/13/stocks-moving-big-midday-z-msft-meta-fis-fsly.html
2023-02-13 12:28:00,Germany and Belgium Consider Second Interconnector for Power Flows,www.bloomberg.com,https://www.bloomberg.com/news/articles/2023-02-13/germany-and-belgium-eye-second-power-interconnector?srnd=markets-vp
2023-02-13 12:16:00,Manchester United close to bid from Qatari investors: reports,foxbusiness.com,https://foxbusiness.com/markets/manchester-united-close-bid-from-qatari-investors-reports
2023-02-13 12:10:00,"Global Liquidity Drain Is Coming for Markets, Citi’s King Says",www.bloomberg.com,https://www.bloomberg.com/news/articles/2023-02-13/citi-s-king-says-global-liquidity-drain-is-coming-for-markets?srnd=markets-vp
2023-02-13 12:06:00,Virgin Atlantic CEO explains how airline is navigating current economic conditions,foxbusiness.com,https://foxbusiness.com/lifestyle/virgin-atlantic-ceo-explains-how-airline-navigating-current-economic-conditions
2023-02-13 11:58:00,Chevron weighs extending CEO Mike Wirth past mandatory retirement age,foxbusiness.com,https://foxbusiness.com/business-leaders/chevron-weighs-extending-ceo-mike-wirth-past-mandatory-retirement-age
2023-02-13 11:56:00,"Hong Kong adds security law clauses to land sales, property stocks drop",www.reuters.com,https://www.reuters.com/world/asia-pacific/hong-kong-adds-security-law-clauses-to-land-sales-property-stocks-drop-2023-02-13/
2023-02-13 11:48:00,: Vodafone stock surges after Liberty Media discloses 4.9% stake,www.marketwatch.com,http://www.marketwatch.com/news/story/vodafone-stock-surges-after-liberty/story.aspx?guid={20C06575-04D4-B545-7198-09489FBD2015}&siteid=rss
2023-02-13 11:27:00,What Layoffs? Top Wall Street Traders Score Giant Paydays,www.nytimes.com,https://www.nytimes.com/2023/02/13/business/hedge-fund-trader-pay.html
2023-02-13 11:08:00,"Americans in January expected mostly stable gains in future inflation, NY Fed says",www.reuters.com,https://www.reuters.com/markets/us/americans-january-expected-mostly-stable-gains-future-inflation-ny-fed-says-2023-02-13/
2023-02-13 11:07:00,"Brexit investment hit costs UK £29bn, says Bank of England policymaker",www.bbc.co.uk,https://www.bbc.co.uk/news/business-64623488?at_medium=RSS&at_campaign=KARANGA
2023-02-13 10:38:00,South Africa's Attacq shares soar on deal to fund Waterfall city,www.reuters.com,https://www.reuters.com/world/africa/south-africas-attacq-shares-soar-deal-fund-waterfall-city-2023-02-13/
2023-02-13 10:35:00,A United 777 made a scary plunge toward the ocean shortly after takeoff,www.cnn.com,https://www.cnn.com/travel/article/united-777-plunge-takeoff-hawaii/index.html
2023-02-13 10:25:00,London bus strikes: Dispute ends after drivers accept pay increase,www.bbc.co.uk,https://www.bbc.co.uk/news/uk-england-london-64626372?at_medium=RSS&at_campaign=KARANGA
2023-02-13 10:11:00,": Twilio to lay off 17% of its employees to cut costs, while providing upbeat Q4 guidance",www.marketwatch.com,http://www.marketwatch.com/news/story/twilio-lay-off-17-its/story.aspx?guid={20C06575-04D4-B545-7197-EBA4FBE4E4B8}&siteid=rss
2023-02-13 10:11:00,Wall Street Trading Desks Map Out Game Plans for CPI Scenarios,www.bloomberg.com,https://www.bloomberg.com/news/articles/2023-02-13/wall-street-trading-desks-map-out-game-plans-for-cpi-scenarios?srnd=markets-vp
2023-02-13 09:51:00,Courier firm DX Group accused by rival of espionage,www.bbc.co.uk,https://www.bbc.co.uk/news/business-64623484?at_medium=RSS&at_campaign=KARANGA
2023-02-13 09:35:00,: U.S. stocks open higher after worst week since December as investors await inflation report,www.marketwatch.com,http://www.marketwatch.com/news/story/us-stocks-open-higher-after/story.aspx?guid={20C06575-04D4-B545-7197-E139A8D0DEF5}&siteid=rss
2023-02-13 09:22:00,Analysis: The deep freeze over UK assets is thawing,www.reuters.com,https://www.reuters.com/world/uk/deep-freeze-over-uk-assets-is-thawing-2023-02-13/
2023-02-13 09:19:00,Paxos ordered to cease minting Binance stablecoin by New York regulator,www.cnbc.com,https://www.cnbc.com/2023/02/13/paxos-ordered-to-cease-minting-binance-stablecoin-by-new-york-regulator.html
2023-02-13 09:10:00,Exxon Is an Exile on Wall Street and Loving It,www.wsj.com,https://www.wsj.com/articles/exxon-is-an-exile-on-wall-street-and-loving-it-487d25f?mod=rss_markets_main
2023-02-13 09:09:00,'Like turkeys at a shooting range': Mauling of Russian forces in Donetsk hotspot may signal problems to come,www.cnn.com,https://www.cnn.com/2023/02/13/europe/russia-ukraine-vuhledar-donetsk-fiasco-intl/index.html
2023-02-13 09:08:00,"What is a rolling recession, and is the US economy in one?",foxbusiness.com,https://foxbusiness.com/economy/what-is-rolling-recession-is-us-economy-one
2023-02-13 09:00:00,Sell on eBay or Get Paid on Venmo? You Probably Owe Taxes,www.wsj.com,https://www.wsj.com/articles/sell-on-ebay-or-get-paid-on-venmo-you-probably-owe-the-irs-taxes-e97172e0?mod=rss_markets_main
2023-02-13 08:51:00,"Stocks making the biggest moves premarket: Fidelity, Ralph Lauren, Caterpillar and more",www.cnbc.com,https://www.cnbc.com/2023/02/13/stocks-making-the-biggest-moves-premarket-fnf-rl-cat.html
2023-02-13 08:50:00,Major Gulf bourses end mixed ahead of U.S. inflation data,www.reuters.com,https://www.reuters.com/world/middle-east/major-gulf-bourses-end-mixed-ahead-us-inflation-data-2023-02-13/
