Date,Title,Source,Link
2023-02-15 17:40:00,: RingCentral stock plunges 10% as sales forecast disappoints,www.marketwatch.com,http://www.marketwatch.com/news/story/ringcentral-stock-plunges-10-sales/story.aspx?guid={20C06575-04D4-B545-719A-E2F04201B90B}&siteid=rss
2023-02-15 17:35:00,Asia Stocks to Rise as Wall Street Turns Bullish: Markets Wrap,www.bloomberg.com,https://www.bloomberg.com/news/articles/2023-02-15/asia-stocks-to-rise-as-wall-street-turns-bullish-markets-wrap?srnd=markets-vp
2023-02-15 17:24:00,: QuantumScape stock drops 14% after narrower quarterly loss,www.marketwatch.com,http://www.marketwatch.com/news/story/quantumscape-stock-drops-14-after/story.aspx?guid={20C06575-04D4-B545-719A-DE087B246795}&siteid=rss
2023-02-15 17:23:00,JPMorgan's top trader sees China as biggest overseas opportunity,www.reuters.com,https://www.reuters.com/business/finance/jpmorgans-top-trader-sees-china-biggest-overseas-opportunity-2023-02-15/
2023-02-15 17:13:00,David Malpass: World Bank director who was called climate denier quits,www.bbc.co.uk,https://www.bbc.co.uk/news/business-64657711?at_medium=RSS&at_campaign=KARANGA
2023-02-15 17:09:00,"Lufthansa IT outage leaves thousands stranded, hundreds of flights canceled",foxbusiness.com,https://foxbusiness.com/economy/lufthansa-it-outage-leaves-thousands-stranded-hundreds-flights-canceled
2023-02-15 17:09:00,"Half of US job switchers received big pay increase in 2022, beating inflation",foxbusiness.com,https://foxbusiness.com/economy/americans-switching-jobs-still-seeing-huge-pay-gains
2023-02-15 17:08:00,‘50 Cent’ VIX Trader Returns as Volatility Hedging Back in Vogue,www.bloomberg.com,https://www.bloomberg.com/news/articles/2023-02-15/-50-cent-vix-trader-returns-as-volatility-hedging-back-in-vogue?srnd=markets-vp
2023-02-15 17:07:00,"Twilio shares surge on better-than-expected revenue, buyback",www.reuters.com,https://www.reuters.com/technology/twilio-shares-surge-better-than-expected-revenue-buyback-2023-02-15/
2023-02-15 17:05:00,"Stocks making the biggest moves after hours: Roku, Cisco Systems, Twilio and more",www.cnbc.com,https://www.cnbc.com/2023/02/15/stocks-moving-big-after-hours-roku-csco-twlo-and-more.html
2023-02-15 17:02:00,"Cisco raises full-year forecast on strong demand, easing supply hurdles",www.reuters.com,https://www.reuters.com/technology/cisco-raises-full-year-revenue-forecast-2023-02-15/
2023-02-15 17:00:00,China’s $2 Trillion LGFV Market Flashes Warning as Funding Drops,www.bloomberg.com,https://www.bloomberg.com/news/articles/2023-02-15/china-s-2-trillion-lgfv-market-flashes-warning-as-funding-drops?srnd=markets-vp
2023-02-15 16:55:00,ASIA BI and BSP decide on rates,www.reuters.com,https://www.reuters.com/markets/asia/global-markets-view-asia-graphic-pix-2023-02-15/
2023-02-15 16:45:00,: Twilio stock jumps 12% after chasing layoffs with first major share-repurchase plan,www.marketwatch.com,http://www.marketwatch.com/news/story/twilio-stock-jumps-12-after/story.aspx?guid={20C06575-04D4-B545-719A-D45F4E696F6A}&siteid=rss
2023-02-15 16:44:00,: Boston Beer stock down 10% after company swings to surprise quarterly loss,www.marketwatch.com,http://www.marketwatch.com/news/story/boston-beer-stock-down-10/story.aspx?guid={20C06575-04D4-B545-719A-D3865E7588EE}&siteid=rss
2023-02-15 16:24:00,"IPO drought will continue, market ‘too risky’",foxbusiness.com,https://foxbusiness.com/markets/ipo-drought-continue-market-too-risky
2023-02-15 16:24:00,Ohio train derailment lawyer issues stark warning to impacted families: 'Don't take the money',foxbusiness.com,https://foxbusiness.com/economy/ohio-train-derailment-lawyer-issues-stark-warning-to-impacted-families-dont-take-the-money
2023-02-15 16:22:00,Charlie Munger says BYD is so far ahead of Tesla in China it's almost ridiculous,www.cnbc.com,https://www.cnbc.com/2023/02/15/charlie-munger-says-byd-is-far-ahead-of-tesla-in-china.html
2023-02-15 16:19:00,: Moderna promises to keep COVID vaccine free,www.marketwatch.com,http://www.marketwatch.com/news/story/moderna-promises-keep-covid-vaccine/story.aspx?guid={20C06575-04D4-B545-719A-C31BECACC199}&siteid=rss
2023-02-15 16:14:00,LeBron James' agent Rich Paul launches New Balance brand,foxbusiness.com,https://foxbusiness.com/lifestyle/lebron-james-agent-rich-paul-launches-new-balance-brand
2023-02-15 16:13:00,Toxic train derailment in Ohio: What to know,www.cnn.com,https://www.cnn.com/2023/02/15/us/toxic-chemicals-train-derailments-explainer/index.html
2023-02-15 16:03:00,: U.S. stocks end higher after stronger-than-expected retail sales,www.marketwatch.com,http://www.marketwatch.com/news/story/us-stocks-end-higher-after/story.aspx?guid={20C06575-04D4-B545-719A-C0BBFB7FEFE6}&siteid=rss
2023-02-15 15:57:00,Airbnb puts worries to bed for now,foxbusiness.com,https://foxbusiness.com/markets/airbnb-puts-worries-bed-now
2023-02-15 15:36:00,Glencore hands $7.1B to shareholders after record profit,foxbusiness.com,https://foxbusiness.com/industrials/glencore-hands-7-1-billion-shareholders-record-profit
2023-02-15 15:28:00,Chipotle to launch new spin-off restaurant Farmesa,foxbusiness.com,https://foxbusiness.com/lifestyle/chipotle-to-launch-new-spin-off-restaurant-farmesa
2023-02-15 15:21:00,"U.S. Could Default on Its Debt Between July and September, C.B.O. Says",www.nytimes.com,https://www.nytimes.com/2023/02/15/us/politics/default-debt-limit-cbo-report.html
2023-02-15 15:03:00,"FTX founder Sam Bankman-Fried's two bond guarantors unsealed, both with ties to Stanford",www.cnbc.com,https://www.cnbc.com/2023/02/15/sam-bankman-frieds-two-bond-guarantors-revealed-after-unsealing-.html
2023-02-15 14:49:00,Gambling revenues hit record $60 billion last year,foxbusiness.com,https://foxbusiness.com/lifestyle/gambling-revenues-hit-record-60-billion-last-year
2023-02-15 14:49:00,": Amazon, Apple, Meta CEOs subpoenaed by House Judiciary chairman",www.marketwatch.com,http://www.marketwatch.com/news/story/amazon-apple-meta-ceos-subpoenaed/story.aspx?guid={20C06575-04D4-B545-719A-A14896FD0287}&siteid=rss
2023-02-15 14:44:00,: Oil futures end lower after EIA reports a hefty weekly rise in U.S. crude supplies,www.marketwatch.com,http://www.marketwatch.com/news/story/oil-futures-end-lower-after/story.aspx?guid={20C06575-04D4-B545-719A-9FDB6DB83431}&siteid=rss
2023-02-15 14:40:00,"Long in Uber’s Shadow, Lyft’s Financial Woes Thrust It Into the Spotlight",www.nytimes.com,https://www.nytimes.com/2023/02/15/technology/lyft-financial-woes.html
2023-02-15 14:24:00,U.S. on Track to Add $19 Trillion in New Debt Over 10 Years,www.nytimes.com,https://www.nytimes.com/2023/02/15/business/national-debt-biden.html
2023-02-15 14:22:00,SEC crypto proposal could bar investment advisors from holding at firms,foxbusiness.com,https://foxbusiness.com/markets/sec-crypto-proposal-could-bar-investment-advisors-from-holding-firms
2023-02-15 14:14:00,TikTok ban a bipartisan effort on Capitol Hill,foxbusiness.com,https://foxbusiness.com/technology/tiktok-ban-a-bipartisan-effort-on-capitol-hill
2023-02-15 13:46:00,Flybe: Administrators unable to find buyer after collapse,www.bbc.co.uk,https://www.bbc.co.uk/news/uk-england-birmingham-64655321?at_medium=RSS&at_campaign=KARANGA
2023-02-15 13:29:00,Airbnb Puts Worries to Bed for Now,www.wsj.com,https://www.wsj.com/articles/airbnb-puts-worries-to-bed-for-now-bb610857?mod=rss_markets_main
2023-02-15 13:16:00,Biogen Boss Turns Corner on Alzheimer's Miscues,www.wsj.com,https://www.wsj.com/articles/biogen-boss-turns-corner-on-alzheimers-miscues-56936d56?mod=rss_markets_main
2023-02-15 12:56:00,Barclays Profit Falls as Deal Making Declines; Shares Drop,www.wsj.com,https://www.wsj.com/articles/barclays-barc-q4-earnings-report-2022-beea1163?mod=rss_markets_main
2023-02-15 12:39:00,Chinese spy flight controversy acting as catalyst for Congress to pass nationwide TikTok ban,foxbusiness.com,https://foxbusiness.com/politics/chinese-spy-flight-controversy-acting-catalyst-congress-pass-nationwide-tiktok-ban
2023-02-15 12:31:00,Homebuilder sentiment jumps in February by biggest amount in a decade,foxbusiness.com,https://foxbusiness.com/economy/homebuilder-sentiment-jumps-february-biggest-amount-decade
2023-02-15 12:21:00,Vice Media gets $30 million-plus lifeline from Fortress as bills pile up,foxbusiness.com,https://foxbusiness.com/markets/vice-media-30-million-lifeline-fortress-bills-pile-up
2023-02-15 12:21:00,Surging egg prices giving rise to plant-based alternatives,foxbusiness.com,https://foxbusiness.com/lifestyle/surging-egg-prices-giving-rise-plant-based-alternatives
2023-02-15 12:12:00,Anglo American Platinum slides on surprise CEO exit plan,www.reuters.com,https://www.reuters.com/world/africa/amplats-ceo-viljoen-step-down-join-newmont-coo-2023-02-15/
2023-02-15 12:10:00,"Stocks making the biggest moves midday: Roblox, Airbnb, Barclays, Silvergate Capital & more",www.cnbc.com,https://www.cnbc.com/2023/02/15/stocks-making-the-biggest-moves-midday-.html
2023-02-15 11:53:00,Robolox shares surge as gamers above 17 years old play,foxbusiness.com,https://foxbusiness.com/markets/robolox-shares-surg-gamers-17-years-old-play
2023-02-15 11:30:00,The U.S. Consumer Bounces Back,www.wsj.com,https://www.wsj.com/articles/the-u-s-consumer-bounces-back-f64a8eb7?mod=rss_markets_main
2023-02-15 11:27:00,: EU to investigate Amazon’s $1.7 billion purchase of iRobot: report,www.marketwatch.com,http://www.marketwatch.com/news/story/eu-investigate-amazons-17-billion/story.aspx?guid={20C06575-04D4-B545-719A-4B2BE3846DEA}&siteid=rss
2023-02-15 11:11:00,Dollar advances to six-week peak after strong U.S. retail sales data,www.reuters.com,https://www.reuters.com/markets/currencies/dollar-finds-friends-after-sticky-us-inflation-readout-2023-02-15/
2023-02-15 11:01:00,Antarctica's Doomsday Glacier 'in trouble' as scientists find surprising formations under ice shelf,www.cnn.com,https://www.cnn.com/2023/02/15/world/thwaites-doomsday-glacier-sea-level-climate-intl/index.html
2023-02-15 10:28:00,Finnair shares hit 12-month high after second straight quarterly profit,www.reuters.com,https://www.reuters.com/business/aerospace-defense/finnair-shares-hit-12-month-high-after-second-straight-quarterly-profit-2023-02-15/
2023-02-15 10:28:00,Cable maker Credo slumps on forecast hit as top customer cuts orders,www.reuters.com,https://www.reuters.com/technology/cable-maker-credo-slumps-forecast-hit-top-customer-cuts-orders-2023-02-15/
2023-02-15 10:26:00,"Democrat-led ESG rules will 'kill' Main Street, CEO warns",foxbusiness.com,https://foxbusiness.com/economy/democrat-led-esg-rules-kill-main-street-ceo-warns
2023-02-15 10:26:00,"Democrats attack ‘obscene’ oil profits with new tax hike, accuse industry of ‘cartel pricing’",foxbusiness.com,https://foxbusiness.com/politics/democrats-attack-obscene-oil-profits-new-tax-hike-accuse-industry-cartel-pricing
2023-02-15 10:06:00,January flows to emerging markets largest in two years - IIF,www.reuters.com,https://www.reuters.com/markets/emerging/january-flows-emerging-markets-largest-two-years-iif-2023-02-15/
2023-02-15 10:01:00,SEC Chair Gensler proposes sweeping changes that would require crypto firms to register in order to custody assets,www.cnbc.com,https://www.cnbc.com/2023/02/15/sec-chair-gensler-crypto-firms-need-to-register-to-custody-assets.html
2023-02-15 10:00:00,SEC Considers Rules That Could Threaten Crypto Custody Services,www.wsj.com,https://www.wsj.com/articles/sec-considers-rules-that-could-threaten-crypto-custody-services-89ba4cd5?mod=rss_markets_main
2023-02-15 09:58:00,Mexico Industrial Park Occupancy Hits Record on Nearshoring Boom,www.bloomberg.com,https://www.bloomberg.com/news/articles/2023-02-15/mexico-industrial-park-occupancy-hits-record-on-nearshoring-boom?srnd=markets-vp
2023-02-15 09:54:00,Lufthansa tech failure leaves planes grounded,www.bbc.co.uk,https://www.bbc.co.uk/news/business-64652835?at_medium=RSS&at_campaign=KARANGA
2023-02-15 09:47:00,Italian fund buys stake in asset manager Anima in play on bank M&A,www.reuters.com,https://www.reuters.com/markets/deals/italian-fund-buys-stake-asset-manager-anima-play-bank-ma-2023-02-15/
2023-02-15 09:39:00,McDonald's puts up prices on five menu items,www.bbc.co.uk,https://www.bbc.co.uk/news/business-64651800?at_medium=RSS&at_campaign=KARANGA
2023-02-15 09:37:00,US Factory Output Rises by Most in Nearly a Year in Broad Gain,www.bloomberg.com,https://www.bloomberg.com/news/articles/2023-02-15/us-factory-production-rises-by-most-in-nearly-a-year?srnd=markets-vp
2023-02-15 09:30:00,Deadly earthquake leaves deep chasm in middle of olive grove,www.cnn.com,https://www.cnn.com/videos/world/2023/02/15/turkey-earthquake-olive-grove-chasm-lon-orig-na.cnn
2023-02-15 09:30:00,Deutsche Bank to Cut Bonus of Staff Misusing WhatsApp Messaging,www.bloomberg.com,https://www.bloomberg.com/news/articles/2023-02-15/deutsche-bank-to-cut-bonus-of-staff-misusing-whatsapp-messaging?srnd=markets-vp
2023-02-15 09:22:00,Forced meter installations suspended for six weeks,www.bbc.co.uk,https://www.bbc.co.uk/news/business-64653228?at_medium=RSS&at_campaign=KARANGA
2023-02-15 09:19:00,Tesla Will Open Some Chargers to All Electric Vehicles,www.nytimes.com,https://www.nytimes.com/2023/02/15/business/energy-environment/tesla-electric-vehicle-chargers-biden.html
2023-02-15 09:03:00,Retail Sales Surge as Prices Rise and Shoppers Keep Buying,www.nytimes.com,https://www.nytimes.com/2023/02/15/business/retail-sales-january-inflation.html
2023-02-15 08:53:00,"New York factory activity contracts less than expected in February, NY Fed says",www.reuters.com,https://www.reuters.com/markets/us/new-york-factory-activity-contracts-less-than-expected-february-ny-fed-says-2023-02-15/
2023-02-15 08:48:00,Analysis: Bond euphoria grinds to a halt as inflation lingers,www.reuters.com,https://www.reuters.com/markets/rates-bonds/bond-euphoria-grinds-halt-inflation-lingers-2023-02-15/
2023-02-15 08:48:00,Roblox dazzles Wall St with bookings beat on holiday boost,www.reuters.com,https://www.reuters.com/technology/roblox-corp-beats-quarterly-bookings-estimates-2023-02-15/
2023-02-15 08:45:00,Retail sales surge 3% in January despite stubbornly high inflation,foxbusiness.com,https://foxbusiness.com/economy/retail-sales-surge-january-stubbornly-high-inflation
2023-02-15 08:38:00,Most Middle Eastern bourses gain; Abu Dhabi falls,www.reuters.com,https://www.reuters.com/world/middle-east/most-middle-eastern-bourses-gain-abu-dhabi-falls-2023-02-15/
2023-02-14 19:02:00,Huel adverts that implied shakes cut food bills ruled misleading,www.bbc.co.uk,https://www.bbc.co.uk/news/business-64637704?at_medium=RSS&at_campaign=KARANGA
2023-02-14 19:00:00,China’s World-Beating Drop in Covid Deaths Revives Data Concerns,www.bloomberg.com,https://www.bloomberg.com/news/articles/2023-02-15/china-s-world-beating-drop-in-covid-deaths-revives-data-concerns?srnd=markets-vp
2023-02-14 18:57:00,Oil Extends Drop on Large Stockpile Build and Inflation Concerns,www.bloomberg.com,https://www.bloomberg.com/news/articles/2023-02-14/oil-extends-drop-on-large-stockpile-build-and-inflation-concerns?srnd=markets-vp
2023-02-14 18:30:00,Are ETFs a hedge for inflation?,foxbusiness.com,https://foxbusiness.com/markets/etfs-hedge-inflation
2023-02-14 18:30:00,Goldman Sachs CEO on probability of economic soft landing,foxbusiness.com,https://foxbusiness.com/economy/goldman-sachs-ceo-probability-economic-soft-landing
2023-02-14 18:22:00,Australia’s Bid to Break China’s Lithium Dominance Hit by Delay,www.bloomberg.com,https://www.bloomberg.com/news/articles/2023-02-14/australia-s-bid-to-break-china-s-lithium-dominance-hit-by-delay?srnd=markets-vp
2023-02-14 18:17:00,"Stocks moving after hours: Airbnb, TripAdvisor, Devon Energy",finance.yahoo.com,https://finance.yahoo.com/news/stocks-moving-in-after-hours-airbnb-tripadvisor-devon-energy-222637536.html
2023-02-14 18:13:00,"Burger King parent names new CEO, aiming to turn around chain",foxbusiness.com,https://foxbusiness.com/business-leaders/burger-king-parent-names-new-ceo-aiming-turn-around-chain
2023-02-14 18:10:00,Mexico's America Movil Q4 net profit tumbles 90%,www.reuters.com,https://www.reuters.com/business/media-telecom/mexicos-america-movil-q4-net-profit-tumbles-90-2023-02-14/
2023-02-14 18:07:00,"Asia Stocks Set for Choppy Open on CPI, Fed Speak: Markets Wrap",www.bloomberg.com,https://www.bloomberg.com/news/articles/2023-02-14/asia-stocks-set-for-choppy-open-on-cpi-fed-speak-markets-wrap
2023-02-14 18:07:00,"‘A different animal’: The bear market is ‘over,’ but don’t unleash the bulls yet, says Wells Fargo",www.marketwatch.com,https://www.marketwatch.com/story/a-different-animal-the-bear-market-is-over-but-that-doesnt-unleash-bulls-to-send-stocks-on-a-2023-tear-according-to-wells-fargo-9e7fb65a
2023-02-14 17:55:00,"Berkshire Hathaway Boosts Stake in Apple, Paramount Global in Relatively Quiet Quarter",www.wsj.com,https://www.wsj.com/articles/berkshire-hathaway-boosts-stake-in-apple-paramount-global-in-relatively-quiet-quarter-dd092f9c?mod=rss_markets_main
2023-02-14 17:45:00,Investors Pour Into Chinese Stock Funds in Reopening Bet,www.wsj.com,https://www.wsj.com/articles/investors-pour-into-chinese-stock-funds-in-reopening-bet-96c8bc85?mod=rss_markets_main
2023-02-14 17:18:00,"Stocks making the big moves after hours: Airbnb, TripAdvisor, Devon Energy and more",www.cnbc.com,https://www.cnbc.com/2023/02/14/stocks-moving-big-after-hours-abnb-trip-dvn.html
2023-02-14 17:07:00,Ford Halts Production of Electric Pickup Over Battery Issue,www.nytimes.com,https://www.nytimes.com/2023/02/14/business/ford-f150-lightning-battery.html
2023-02-14 17:06:00,"Gunman who killed 3 Michigan State students may have planned to attack NJ schools, police say",www.cnn.com,https://www.cnn.com/2023/02/14/us/michigan-state-university-shots-fired-tuesday/index.html
2023-02-14 16:53:00,Tesla workers launch first ever union campaign,www.bbc.co.uk,https://www.bbc.co.uk/news/business-64639669?at_medium=RSS&at_campaign=KARANGA
2023-02-14 16:53:00,ASIA Movin' on up,www.reuters.com,https://www.reuters.com/markets/us/global-markets-view-asia-graphic-pix-2023-02-14/
2023-02-14 16:37:00,: Herbalife stock bounces back even as earnings and revenue continue to decline,www.marketwatch.com,http://www.marketwatch.com/news/story/herbalife-stock-bounces-back-even/story.aspx?guid={20C06575-04D4-B545-7199-9A89655B647A}&siteid=rss
2023-02-14 16:34:00,"Berkshire Beefs Up Stakes in Apple, Paramount, Louisiana-Pacific",www.bloomberg.com,https://www.bloomberg.com/news/articles/2023-02-14/berkshire-beefs-up-apple-paramount-louisiana-pacific-stakes?srnd=markets-vp
2023-02-14 16:19:00,Energy expert sounds alarm over California power grid: 'Stressed to the limit',foxbusiness.com,https://foxbusiness.com/energy/energy-expert-sounds-alarm-california-power-grid-stressed-limit
2023-02-14 16:17:00,Wall Street Games Out a ‘No Landing’ in Era of Stock Turbulence,www.bloomberg.com,https://www.bloomberg.com/news/articles/2023-02-14/wall-street-games-out-a-no-landing-in-era-of-stock-turbulence?srnd=markets-vp
2023-02-14 16:09:00,: Dow falls 150 points as U.S. stocks see mixed reaction to January inflation report,www.marketwatch.com,http://www.marketwatch.com/news/story/dow-falls-150-points-us/story.aspx?guid={20C06575-04D4-B545-7199-8DB8E4C09FAE}&siteid=rss
2023-02-14 16:02:00,Reddit aims for IPO in second half of 2023 - The Information,www.reuters.com,https://www.reuters.com/technology/reddit-aims-ipo-second-half-2023-information-2023-02-14/
2023-02-14 15:44:00,Subway says it's considering selling,foxbusiness.com,https://foxbusiness.com/markets/subway-says-considering-selling
2023-02-14 15:40:00,Commonwealth Bank Profit Meets Estimates as Rates Buoy Margins,www.bloomberg.com,https://www.bloomberg.com/news/articles/2023-02-14/commonwealth-bank-profit-meets-estimates-as-rates-buoy-margins?srnd=markets-vp
2023-02-14 15:36:00,Hale & Hearty Ends Dispute With Rogue Soup Maker. Now It’s Preparing to Sell Recipes,www.bloomberg.com,https://www.bloomberg.com/news/articles/2023-02-14/hale-hearty-ends-dispute-with-rogue-soup-maker-prepares-sale?srnd=markets-vp
2023-02-14 15:25:00,Petito lawyer says Laundrie's mom wrote letter with offer to bury a body,www.cnn.com,https://www.cnn.com/2023/02/14/us/gabby-petito-brian-laundrie-letter-burn-after-reading/index.html
2023-02-14 15:11:00,Inflation Report Spurs Choppy Trading in Stocks,www.wsj.com,https://www.wsj.com/livecoverage/stock-market-news-today-02-14-2023
2023-02-14 15:06:00,Tesla workers in New York launch union drive,foxbusiness.com,https://foxbusiness.com/markets/tesla-workers-ny-union-drive
2023-02-14 15:06:00,Airbus plans to boost production of biggest jets amid rebounding demand,foxbusiness.com,https://foxbusiness.com/markets/airbus-plans-boost-production-biggest-jets-amid-rebounding-demand
2023-02-14 14:56:00,Ford halts production of electric pickup after ‘potential’ battery issue,foxbusiness.com,https://foxbusiness.com/markets/ford-halts-production-electric-pickup-potential-battery-issue
2023-02-14 14:41:00,: Oil futures mark first loss in 3 sessions,www.marketwatch.com,http://www.marketwatch.com/news/story/oil-futures-mark-first-loss/story.aspx?guid={20C06575-04D4-B545-7199-671D9C8B0A83}&siteid=rss
2023-02-14 14:21:00,Walmart to Close Three Tech Hubs,www.nytimes.com,https://www.nytimes.com/2023/02/14/business/walmart-tech-hubs-closing.html
2023-02-14 14:21:00,"Argentina Annual Inflation Hits 99%, Surpassing Expectations",www.bloomberg.com,https://www.bloomberg.com/news/articles/2023-02-14/argentina-s-annual-inflation-soars-above-expectations-to-99?srnd=markets-vp
2023-02-14 14:16:00,Sen. Dianne Feinstein says she won't seek re-election in 2024,www.marketwatch.com,http://www.marketwatch.com/news/story/sen-dianne-feinstein-says-she/story.aspx?guid={018ADFC8-3489-426E-82C2-A7639F256B8B}&siteid=rss
2023-02-14 14:14:00,: NY Fed’s Williams says fight against inflation has a ‘way to go’,www.marketwatch.com,http://www.marketwatch.com/news/story/ny-feds-williams-says-fight/story.aspx?guid={20C06575-04D4-B545-7199-5DB77B75E481}&siteid=rss
2023-02-14 14:07:00,": Bipartisan Senators blast Big Tech, urge regulation",www.marketwatch.com,http://www.marketwatch.com/news/story/bipartisan-senators-blast-big-tech/story.aspx?guid={20C06575-04D4-B545-7199-4908FD1003FC}&siteid=rss
2023-02-14 14:04:00,: Republican FTC Commissioner Wilson says she’s quitting agency and blasts Chair Lina Khan,www.marketwatch.com,http://www.marketwatch.com/news/story/republican-ftc-commissioner-wilson-says/story.aspx?guid={20C06575-04D4-B545-7199-51B64278E359}&siteid=rss
2023-02-14 13:57:00,: Avis Budget’s big stock rally give Dow transports a 99-point boost,www.marketwatch.com,http://www.marketwatch.com/news/story/avis-budgets-big-stock-rally/story.aspx?guid={20C06575-04D4-B545-7199-57B9799DBF0F}&siteid=rss
2023-02-14 13:55:00,Analysis: U.S. stock rally faces uphill climb after mixed inflation data,www.reuters.com,https://www.reuters.com/markets/us/us-stock-rally-faces-uphill-climb-after-mixed-inflation-data-2023-02-14/
2023-02-14 13:51:00,Meta Platforms says chief business officer to exit,foxbusiness.com,https://foxbusiness.com/markets/meta-platforms-says-chief-business-officer-to-exit
2023-02-14 13:43:00,TikTok’s talks with US have an unofficial player: China,foxbusiness.com,https://foxbusiness.com/politics/tiktoks-talks-unofficial-player-china
2023-02-14 13:42:00,: Occidental Petroleum stock surges after Warren Buffett’s Berkshire Hathaway discloses boosting stake to 28%,www.marketwatch.com,http://www.marketwatch.com/news/story/occidental-petroleum-stock-surges-after/story.aspx?guid={20C06575-04D4-B545-7199-515BD69AB289}&siteid=rss
2023-02-14 13:37:00,: Gold futures end higher after a volatile trading session,www.marketwatch.com,http://www.marketwatch.com/news/story/gold-futures-end-higher-after/story.aspx?guid={20C06575-04D4-B545-7199-4FFC26595E69}&siteid=rss
2023-02-14 13:32:00,Laid-off tech workers seek leverage on the way out,foxbusiness.com,https://foxbusiness.com/economy/laid-off-tech-workers-seek-leverage-way-out
2023-02-14 13:23:00,"Biden to pick Federal Reserve's Lael Brainard, Jared Bernstein as top economic advisers",foxbusiness.com,https://foxbusiness.com/politics/biden-pick-federal-reserve-lael-brainard-jared-bernstein-top-economic-advisers
2023-02-14 13:23:00,"Walmart closing three tech hubs, asking employees to relocate",foxbusiness.com,https://foxbusiness.com/lifestyle/walmart-closing-three-tech-hubs-employees-relocate
2023-02-14 13:21:00,"For Mining EV Metals, the Arctic Is Hot",www.wsj.com,https://www.wsj.com/articles/for-mining-ev-metals-the-arctic-is-hot-8299d1cc?mod=rss_markets_main
2023-02-14 13:20:00,Woe Canada! Energy Outlook Sours as Natural Gas Prices Collapse,www.bloomberg.com,https://www.bloomberg.com/news/articles/2023-02-14/woe-canada-energy-outlook-sours-as-natural-gas-prices-collapse?srnd=markets-vp
2023-02-14 13:17:00,Saudi Arabia's PIF says U.S. stocks value falls nearly $6 billion in fourth quarter,www.reuters.com,https://www.reuters.com/world/middle-east/saudi-arabias-pif-says-us-stocks-value-falls-nearly-6-billion-fourth-quarter-2023-02-14/
2023-02-14 13:15:00,Amazon to double down on grocery business despite recent setbacks,foxbusiness.com,https://foxbusiness.com/markets/amazon-to-double-down-grocery-business-despite-recent-setbacks
2023-02-14 12:43:00,Ghana Debt Holders Trade $6.8 Billion in First Part of Swap,www.bloomberg.com,https://www.bloomberg.com/news/articles/2023-02-14/ghana-bondholders-traded-6-8-billion-in-first-part-of-debt-swap?srnd=markets-vp
2023-02-14 12:33:00,"Michigan State University gunman had note in his pocket with threat to two NJ schools, officials say",edition.cnn.com,https://edition.cnn.com/webview/us/live-news/michigan-state-university-shooting-updates-2-14-23/index.html
