Date,Title,Source,Link
2023-02-16 17:16:00,Fugitive Stablecoin Founder Do Kwon Accused of Securities Fraud in U.S.,www.wsj.com,https://www.wsj.com/articles/fugitive-stablecoin-founder-do-kwon-accused-of-securities-fraud-in-u-s-6da8f781?mod=rss_markets_main
2023-02-16 17:12:00,"SEC charges Do Kwon, Terraform with fraud in connection with Terra collapse",www.cnbc.com,https://www.cnbc.com/2023/02/16/sec-charges-do-kwon-with-fraud-in-connection-with-terra-collapse.html
2023-02-16 17:05:00,Microsoft Considers More Limits for Its New A.I. Chatbot,www.nytimes.com,https://www.nytimes.com/2023/02/16/technology/microsoft-bing-chatbot-limits.html
2023-02-16 16:57:00,Renault CEO: Ampere unit start timing is \,www.reuters.com,https://www.reuters.com/business/autos-transportation/renault-ceo-ampere-unit-start-timing-is-ideally-by-end-2023-2023-02-16/
2023-02-16 16:57:00,Crypto Crisis: A Timeline of Key Events,www.wsj.com,https://www.wsj.com/articles/crypto-crisis-a-timeline-of-key-events-11675519887?mod=rss_markets_main
2023-02-16 16:53:00,ASIA Bulls in a China shop,www.reuters.com,https://www.reuters.com/markets/global-markets-view-asia-graphic-pix-2023-02-16/
2023-02-16 16:32:00,: Moderna stock falls 5% after flu vaccine study results,www.marketwatch.com,http://www.marketwatch.com/news/story/moderna-stock-falls-5-after/story.aspx?guid={20C06575-04D4-B545-719C-247FB1D46AB0}&siteid=rss
2023-02-16 16:24:00,Biden says last three objects shot down were not related to China spy programs,www.cnn.com,https://www.cnn.com/2023/02/16/politics/president-biden-downed-objects/index.html
2023-02-16 16:20:00,: Applied Materials fiscal Q1 tops views on ‘growing’ service business,www.marketwatch.com,http://www.marketwatch.com/news/story/applied-materials-fiscal-q1-tops/story.aspx?guid={20C06575-04D4-B545-719C-2711FD7412CD}&siteid=rss
2023-02-16 16:15:00,Shares of Aircraft Lessors Take Off in Tight Market for Planes,www.wsj.com,https://www.wsj.com/articles/shares-of-aircraft-lessors-take-off-in-tight-market-for-planes-c6e706e?mod=rss_markets_main
2023-02-16 16:06:00,Stocks Sink as Fed Officials Embrace Bigger Hikes: Markets Wrap,www.bloomberg.com,https://www.bloomberg.com/news/articles/2023-02-15/asia-stocks-to-rise-as-wall-street-turns-bullish-markets-wrap
2023-02-16 16:06:00,"Stocks sell off after more hot inflation data, hawkish Fedspeak",finance.yahoo.com,https://finance.yahoo.com/news/stock-market-news-live-updates-february-16-2023-122740853.html
2023-02-16 16:06:00,": Dow falls 400 points as stocks suffer worst drop in a month after PPI data, Fed comments",www.marketwatch.com,http://www.marketwatch.com/news/story/dow-falls-400-points-stocks/story.aspx?guid={20C06575-04D4-B545-719C-20258C780B6F}&siteid=rss
2023-02-16 16:00:00,Korean Babysitter App Seeks to Ease Guilt Among Mothers Torn Between Child and Career,www.bloomberg.com,https://www.bloomberg.com/news/articles/2023-02-16/korean-babysitter-app-fights-guilt-among-mothers-torn-between-child-and-career?srnd=markets-vp
2023-02-16 16:00:00,: Facebook parent company Meta introduces broadcast channels to Instagram,www.marketwatch.com,http://www.marketwatch.com/news/story/facebook-parent-company-meta-introduces/story.aspx?guid={20C06575-04D4-B545-719C-1C63274D98FD}&siteid=rss
2023-02-16 15:33:00,A stock-market catastrophe in the making? The popularity of these risky option bets has Wall Street on edge,www.marketwatch.com,https://www.marketwatch.com/story/a-potential-stock-market-catastrophe-in-the-making-the-popularity-of-these-risky-option-bets-has-wall-street-on-edge-663a0835
2023-02-16 15:31:00,Credit card debt soars to new record as high inflation squeezes Americans,foxbusiness.com,https://foxbusiness.com/economy/credit-card-debt-soars-new-record-high-inflation-squeezes-americans
2023-02-16 15:17:00,CNN anchor explains Biden's lack of transparency on the flying objects,www.cnn.com,https://www.cnn.com/videos/politics/2023/02/16/biden-speaks-flying-objects-balloons-nr-phillip-vpx.cnn
2023-02-16 15:05:00,Norfolk Southern CEO to East Palestine: 'We will not walk away',foxbusiness.com,https://foxbusiness.com/markets/norfolk-southern-ceo-to-east-palestine-we-will-not-walk-away
2023-02-16 15:01:00,": Sen. Fetterman has checked himself into hospital for clinical depression, aide says",www.marketwatch.com,http://www.marketwatch.com/news/story/sen-fetterman-has-checked-himself/story.aspx?guid={20C06575-04D4-B545-719C-031699135FA1}&siteid=rss
2023-02-16 14:55:00,Tesla recalls some of its cars with self-driving software,www.bbc.co.uk,https://www.bbc.co.uk/news/business-64665913?at_medium=RSS&at_campaign=KARANGA
2023-02-16 14:53:00,Emails Reveal Deep Ties Between Jeffrey Epstein and Former Barclays CEO Staley,www.wsj.com,https://www.wsj.com/articles/emails-reveal-deep-ties-between-jeffrey-epstein-former-barclays-ceo-jes-staley-d0af17e5?mod=rss_markets_main
2023-02-16 14:45:00,": Bed Bath & Beyond falls toward 8th-straight loss, the longest such streak in 3 months",www.marketwatch.com,http://www.marketwatch.com/news/story/bed-bath-beyond-falls/story.aspx?guid={20C06575-04D4-B545-719B-FD3B18A3DF53}&siteid=rss
2023-02-16 14:42:00,: Oil futures settle lower for a third straight session,www.marketwatch.com,http://www.marketwatch.com/news/story/oil-futures-settle-lower-third/story.aspx?guid={20C06575-04D4-B545-719B-FC94512136DD}&siteid=rss
2023-02-16 14:28:00,"Susan Wojcicki, YouTube’s Longtime CEO, Says She Will Step Down",www.nytimes.com,https://www.nytimes.com/2023/02/16/technology/susan-wojcicki-youtube-ceo-step-down.html
2023-02-16 14:21:00,"Mexico's FEMSA to launch $3.5 bln share, notes offer in Heineken divestment bid",www.reuters.com,https://www.reuters.com/markets/deals/mexicos-femsa-launch-35-bln-share-notes-offer-heineken-divestment-bid-2023-02-16/
2023-02-16 14:18:00,: Arch Resources stock charges higher after quarterly profit more than doubles expectations,www.marketwatch.com,http://www.marketwatch.com/news/story/arch-resources-stock-charges-higher/story.aspx?guid={20C06575-04D4-B545-719B-F10EC63D90A6}&siteid=rss
2023-02-16 14:10:00,Housing starts fall in January to the lowest level since 2020,foxbusiness.com,https://foxbusiness.com/economy/housing-starts-fall-january-lowest-level-2020
2023-02-16 13:50:00,: Gold futures give up early losses to finish higher,www.marketwatch.com,http://www.marketwatch.com/news/story/gold-futures-give-up-early/story.aspx?guid={20C06575-04D4-B545-719B-E180EC62B830}&siteid=rss
2023-02-16 13:43:00,"Tesla recalls 362,000 U.S. vehicles over Full Self-Driving software",www.reuters.com,https://www.reuters.com/business/autos-transportation/tesla-recalls-362000-us-vehicles-over-full-self-driving-software-2023-02-16/
2023-02-16 13:39:00,Etsy shares fall after Citron Research calls out platform for counterfeit goods,www.reuters.com,https://www.reuters.com/technology/etsy-shares-fall-after-citron-research-calls-out-platform-counterfeit-goods-2023-02-16/
2023-02-16 13:26:00,"Tesla to Recall 362,000 Cars With Its ‘Full Self-Driving’ System",www.nytimes.com,https://www.nytimes.com/2023/02/16/business/tesla-recall-full-self-driving.html
2023-02-16 13:25:00,YouTube CEO Susan Wojcicki stepping down,foxbusiness.com,https://foxbusiness.com/technology/youtube-ceo-susan-wojcicki-stepping-down
2023-02-16 13:22:00,Takeaways from the partial release of a Georgia grand jury report on Trump and 2020 election,www.cnn.com,https://www.cnn.com/2023/02/16/politics/takeaways-trump-georgia-grand-jury-report/index.html
2023-02-16 13:16:00,"DocuSign to cut 10% of workforce, nearly 700 employees will lose jobs",foxbusiness.com,https://foxbusiness.com/markets/docusign-cut-10-workforce-nearly-700-employees-lose-jobs
2023-02-16 13:08:00,"Biden admin stifling Alaska oil drilling project would hurt 'indigenous' communities the most, oil exec warns",foxbusiness.com,https://foxbusiness.com/energy/biden-admin-stifling-alaska-oil-drilling-project-hurt-indigenous-communities-most-oil-exec-warns
2023-02-16 13:08:00,Bitcoin hits six-month high,foxbusiness.com,https://foxbusiness.com/markets/bitcoin-hits-six-month-high
2023-02-16 12:58:00,"US escalates Apple probe, looks to involve antitrust chief",foxbusiness.com,https://foxbusiness.com/politics/us-escalates-apple-probe-looks-involve-antitrust-chief
2023-02-16 12:48:00,Rail workers to stage more strikes in pay dispute,www.bbc.co.uk,https://www.bbc.co.uk/news/business-64661647?at_medium=RSS&at_campaign=KARANGA
2023-02-16 12:46:00,"Airbus eyes slower, more feasible recovery after supply snags",www.reuters.com,https://www.reuters.com/business/aerospace-defense/airbus-targets-720-deliveries-2023-2023-02-16/
2023-02-16 12:46:00,The latest on the Ohio toxic train disaster,edition.cnn.com,https://edition.cnn.com/webview/us/live-news/ohio-train-derailment-east-palestine-02-16-23/index.html
2023-02-16 12:44:00,When U.S.-China Relations Go 'Pop',www.wsj.com,https://www.wsj.com/articles/when-u-s-china-relations-go-pop-f53be8c7?mod=rss_markets_main
2023-02-16 12:41:00,"Anson Hedge Fund Pivots to Long Wagers, Betting on Weed Stocks",www.bloomberg.com,https://www.bloomberg.com/news/articles/2023-02-16/anson-hedge-fund-goes-long-with-bets-on-us-pot-despite-volatile-journey?srnd=markets-vp
2023-02-16 12:38:00,: Snap says it has passed 750 monthly active users,www.marketwatch.com,http://www.marketwatch.com/news/story/snap-says-has-passed-750/story.aspx?guid={20C06575-04D4-B545-719B-B8934DADBC87}&siteid=rss
2023-02-16 12:35:00,"FTSE 100 closes above 8,000 on positive Centrica, StanChart earnings",www.reuters.com,https://www.reuters.com/markets/europe/ftse-100-closes-above-8000-positive-centrica-stanchart-earnings-2023-02-16/
2023-02-16 12:31:00,The world's biggest food company says prices will rise further this year,www.cnn.com,https://www.cnn.com/2023/02/16/business-food/nestle-food-consumer-prices/index.html
2023-02-16 12:31:00,BP to buy TravelCenters of America for $1.3B,foxbusiness.com,https://foxbusiness.com/energy/bp-buy-travelcenters-america-1-3-billion
2023-02-16 12:14:00,Crypto Layoffs and Bankruptcies in 2023: The List to Watch,www.wsj.com,https://www.wsj.com/articles/crypto-layoffs-and-bankruptcies-in-2023-heres-the-list-to-watch-7d85b645?mod=rss_markets_main
2023-02-16 12:10:00,Shopify sinks as investors worry over big spending in weak economy,www.reuters.com,https://www.reuters.com/business/retail-consumer/shopify-sinks-investors-worry-over-big-spending-weak-economy-2023-02-16/
2023-02-16 12:02:00,Strikes Update: How Friday 17 February’s walkouts will affect you,www.bbc.co.uk,https://www.bbc.co.uk/news/business-64651784?at_medium=RSS&at_campaign=KARANGA
2023-02-16 12:01:00,Postal workers vote to strike again,www.bbc.co.uk,https://www.bbc.co.uk/news/business-64661648?at_medium=RSS&at_campaign=KARANGA
2023-02-16 12:00:00,The Biggest Mistakes People Make With Their Wills,www.wsj.com,https://www.wsj.com/articles/biggest-mistakes-wills-2d13dc44?mod=rss_markets_main
2023-02-16 11:56:00,"Stocks making the biggest moves midday: Twilio, Tripadvisor, Boston Beer, Roku and more",www.cnbc.com,https://www.cnbc.com/2023/02/16/stocks-making-the-biggest-moves-midday-twilio-tripadvisor-boston-beer-roku-and-more.html
2023-02-16 11:20:00,Philadelphia Fed manufacturing gauge plunges unexpectedly,www.reuters.com,https://www.reuters.com/markets/us/philadelphia-fed-manufacturing-gauge-plunges-unexpectedly-2023-02-16/
2023-02-16 11:17:00,Abu Dhabi's ADNOC to float 4% of gas business -sources,www.reuters.com,https://www.reuters.com/markets/deals/abu-dhabis-adnoc-float-4-gas-business-sources-2023-02-16/
2023-02-16 11:15:00,Bitcoin's Future Depends on Six Mysterious Coders,www.wsj.com,https://www.wsj.com/articles/bitcoin-core-maintainers-crypto-7b93804?mod=rss_markets_main
2023-02-16 11:09:00,Cisco's Catch-Up Is Worth Catching,www.wsj.com,https://www.wsj.com/articles/ciscos-catch-up-is-worth-catching-19df82fd?mod=rss_markets_main
2023-02-16 11:03:00,"OPEC+ Deal Will Remain in Place All Year, Saudi Minister Says",www.bloomberg.com,https://www.bloomberg.com/news/articles/2023-02-16/opec-deal-will-remain-in-place-all-year-saudi-minister-says?srnd=markets-vp
2023-02-16 11:00:00,"Apollo, HPS Pile Into Record $5.5 Billion Private Credit Deal",www.bloomberg.com,https://www.bloomberg.com/news/articles/2023-02-16/apollo-hps-pile-into-record-5-5-billion-private-credit-deal?srnd=markets-vp
2023-02-16 10:57:00,Dow Lags Market by Most Since 1934 as Stock Rotation Continues,www.bloomberg.com,https://www.bloomberg.com/news/articles/2023-02-16/dow-jones-industrial-average-djia-lags-market-as-stock-rotation-continues?srnd=markets-vp
2023-02-16 10:56:00,WeWork issues glum revenue forecast as tech layoffs hurt,www.reuters.com,https://www.reuters.com/business/wework-turns-core-profit-dec-first-time-since-listing-2023-02-16/
2023-02-16 10:49:00,"Zero-Day Options Are Like Betting on ‘Horse Race,’ Tchir Says",www.bloomberg.com,https://www.bloomberg.com/news/articles/2023-02-16/peter-tchir-likens-zero-day-options-trading-to-betting-on-horse-race?srnd=markets-vp
2023-02-16 10:20:00,U.S. labor market remains tight; monthly producer prices accelerate,www.reuters.com,https://www.reuters.com/markets/us/us-weekly-jobless-claims-fall-monthly-producer-prices-rebound-2023-02-16/
2023-02-16 10:20:00,"PBF Energy posts bumper quarterly profit, partners with Eni on biorefinery",www.reuters.com,https://www.reuters.com/business/energy/refiner-pbf-energy-posts-bumper-fourth-quarter-profit-2023-02-16/
2023-02-16 10:01:00,Zambia President Slams ‘Black Mamba Kiss of Death’ Lending Rates,www.bloomberg.com,https://www.bloomberg.com/news/articles/2023-02-16/zambia-president-slams-black-mamba-kiss-of-death-lending-rates?srnd=markets-vp
2023-02-16 10:01:00,Oil Stampede Is On in One of the Emptiest Places in the Americas,www.bloomberg.com,https://www.bloomberg.com/news/articles/2023-02-16/suriname-s-oil-exploration-challenges-are-a-warning-for-oil-consumers?srnd=markets-vp
2023-02-16 09:51:00,"Stocks Fall, Yields Rise as Data Rattles Investors",www.wsj.com,https://www.wsj.com/livecoverage/stock-market-news-today-02-16-2023
2023-02-16 09:50:00,Will ChatGPT repeat the dot-com and crypto crashes?,foxbusiness.com,https://foxbusiness.com/technology/will-chatgpt-repeat-the-dot-com-and-crypto-crashes
2023-02-16 09:43:00,"Tesla Fired Buffalo Workers Seeking to Organize, Union Says",www.nytimes.com,https://www.nytimes.com/2023/02/16/business/tesla-buffalo-union.html
2023-02-16 09:36:00,Adani Aims to Tackle Debt Deadlines With Cash and Private Notes,www.bloomberg.com,https://www.bloomberg.com/news/articles/2023-02-16/adani-to-have-refinance-plan-end-june-for-2024-green-energy-bond-le7613kv?srnd=markets-vp
2023-02-16 09:24:00,Roku shares jump on promise of turning a profit,www.reuters.com,https://www.reuters.com/business/roku-shares-jump-promise-turning-profit-2023-02-16/
2023-02-16 09:21:00,"Correction: Stocks making the biggest premarket moves: Shake Shack, Virgin Galactic, Paramount and more",www.cnbc.com,https://www.cnbc.com/2023/02/16/stocks-making-the-biggest-moves-midday-shak-spce-para.html
2023-02-16 09:19:00,Ryan Seacrest Is Leaving ‘Live with Kelly and Ryan’,www.nytimes.com,https://www.nytimes.com/2023/02/16/business/media/ryan-seacrest-kelly-ripa-live.html
2023-02-16 09:02:00,BP to buy TravelCenters of America for $1.3 billion,www.reuters.com,https://www.reuters.com/markets/deals/bp-buy-travelcenters-america-13-billion-2023-02-16/
2023-02-16 08:43:00,Norfolk Southern skips tense Ohio train derailment town hall,foxbusiness.com,https://foxbusiness.com/economy/norfolk-southern-skips-tense-east-palestine-ohio-train-derailment-town-hall
2023-02-16 08:43:00,"Wholesale inflation surges 0.7% in January, more than expected as high prices persist",foxbusiness.com,https://foxbusiness.com/economy/wholesale-inflation-surges-january-more-expected-high-prices-persist
2023-02-16 08:40:00,"Scottish politics are in turmoil, but it's small fry for the pound",www.reuters.com,https://www.reuters.com/world/europe/scottish-politics-are-turmoil-its-small-fry-pound-2023-02-16/
2023-02-16 08:22:00,KitKat maker Nestle to raise prices again,www.bbc.co.uk,https://www.bbc.co.uk/news/business-64664292?at_medium=RSS&at_campaign=KARANGA
2023-02-16 08:11:00,"Nigeria Central Bank May Delay Forex Loan Payments on Dollar Shortage, Moody’s Says",www.bloomberg.com,https://www.bloomberg.com/news/articles/2023-02-16/nigeria-central-bank-may-delay-paying-10-billion-to-lenders?srnd=markets-vp
2023-02-16 08:01:00,"EU top court adviser backs FX borrowers, Polish bank stocks fall",www.reuters.com,https://www.reuters.com/business/finance/banks-may-not-charge-invalid-loans-says-eu-top-court-adviser-2023-02-16/
2023-02-16 07:57:00,Goldman Strategists See More US Spinoffs With Companies Squeezed,www.bloomberg.com,https://www.bloomberg.com/news/articles/2023-02-16/goldman-strategists-see-more-us-spinoffs-with-companies-squeezed?srnd=markets-vp
2023-02-16 07:51:00,Stock Futures Waver Ahead of Raft of Economic Data,www.wsj.com,https://www.wsj.com/articles/global-stocks-markets-dow-update-02-16-2023-b840b44f?mod=rss_markets_main
2023-02-16 07:42:00,Wall St futures slip ahead of inflation data,www.reuters.com,https://www.reuters.com/markets/us/wall-st-futures-slip-ahead-inflation-data-2023-02-16/
2023-02-16 07:30:00,World’s Top Junk-Muni Fund Is Loaded With a Rarely Traded Stock,www.bloomberg.com,https://www.bloomberg.com/news/articles/2023-02-16/top-holding-in-nuveen-muni-funds-isn-t-a-bond-it-s-a-stock-that-rarely-trades?srnd=markets-vp
2023-02-16 07:28:00,BlackRock’s Hedge Fund Star Seeks $1 Billion After Biggest Loss,www.bloomberg.com,https://www.bloomberg.com/news/articles/2023-02-16/blackrock-s-hedge-fund-star-seeks-1-billion-after-biggest-loss?srnd=markets-vp
2023-02-16 07:21:00,"China announces new sanctions against Lockheed Martin, Raytheon for Taiwan military sales",foxbusiness.com,https://foxbusiness.com/economy/china-sanctions-lockheed-martin-raytheon-taiwan-military-sales
2023-02-16 07:14:00,Paramount misses quarterly revenue estimates on advertising weakness,www.reuters.com,https://www.reuters.com/business/media-telecom/paramount-misses-quarterly-revenue-estimates-2023-02-16/
2023-02-16 07:09:00,Magic: the Gathering Becomes Billion-Dollar Brand for Hasbro,www.nytimes.com,https://www.nytimes.com/2023/02/16/business/magic-the-gathering-hasbro.html
2023-02-16 06:35:00,Hasbro 2023 profit forecast disappoints as toy demand drops sharply,www.reuters.com,https://www.reuters.com/business/retail-consumer/hasbro-2023-profit-forecast-disappoints-toy-demand-drops-sharply-2023-02-16/
2023-02-16 10:29:00,Europe's Gas-Price Ceiling Already Shows Cracks,www.wsj.com,https://www.wsj.com/articles/europes-gas-price-ceiling-already-shows-cracks-5fab8cf9?mod=rss_markets_main
2023-02-16 16:31:00,"For the First Time, Genetically Modified Trees Have Been Planted in a U.S. Forest",www.nytimes.com,https://www.nytimes.com/2023/02/16/science/genetically-modified-trees-living-carbon.html
2023-02-16 14:54:00,Biden says last three objects were not related to China spy programs,edition.cnn.com,https://edition.cnn.com/webview/politics/live-news/biden-downed-objects-speech/index.html
2023-02-16 11:24:00,Judge releases parts of Georgia grand jury report on Trump and the 2020 US election,edition.cnn.com,https://edition.cnn.com/webview/politics/live-news/trump-georgia-report-release-02-16-23/index.html
2023-02-16 09:57:00,Goldman Sachs Steps Back From Bidding for New Credit Card Programs,www.wsj.com,https://www.wsj.com/articles/goldman-sachs-steps-back-from-bidding-for-new-credit-card-programs-26908c70?mod=rss_markets_main
2023-02-16 06:30:00,Five Things You Need to Know to Start Your Day,www.bloomberg.com,https://www.bloomberg.com/news/newsletters/2023-02-16/five-things-you-need-to-know-to-start-your-day?srnd=markets-vp
2023-02-16 06:19:00,Factbox: The U.S. debt ceiling and markets: Gauging the fallout,www.reuters.com,https://www.reuters.com/markets/us/us-debt-ceiling-markets-gauging-fallout-2023-02-16/
2023-02-16 06:18:00,Dr. Sanjay Gupta rides on helicopter delivering aid to Turkey quake region,www.cnn.com,https://www.cnn.com/videos/world/2023/02/16/turkey-earthquake-help-aid-makeshift-hospitals-sanjay-gupta-pkg-ovn-intl-ldn-vpx.cnn
2023-02-16 06:15:00,"Apollo, Goldman Plan Private Credit Funds for Rich Europeans",www.bloomberg.com,https://www.bloomberg.com/news/articles/2023-02-16/apollo-goldman-plan-private-credit-funds-for-rich-europeans?srnd=markets-vp
2023-02-16 13:39:00,": Intuitive Machines stock skyrockets, has tripled in 3 days after SPAC merger completed",www.marketwatch.com,http://www.marketwatch.com/news/story/intuitive-machines-stock-skyrockets-has/story.aspx?guid={20C06575-04D4-B545-719B-DCD732135E4B}&siteid=rss
2023-02-16 13:06:00,: Tesla stock turns lower after recall news,www.marketwatch.com,http://www.marketwatch.com/news/story/tesla-stock-turns-lower-after/story.aspx?guid={20C06575-04D4-B545-719B-CB2F53F25AB9}&siteid=rss
2023-02-16 12:44:00,"Behind China’s Balloons, a Push for Business to Serve the Military",www.nytimes.com,https://www.nytimes.com/2023/02/16/world/asia/spy-balloon-military-china.html
2023-02-16 12:37:00,: YouTube CEO steps down,www.marketwatch.com,http://www.marketwatch.com/news/story/youtube-ceo-steps-down/story.aspx?guid={20C06575-04D4-B545-719B-B7D2E6393A5B}&siteid=rss
2023-02-16 11:33:00,: Trump Georgia grand jury recommends indictments for perjury,www.marketwatch.com,http://www.marketwatch.com/news/story/trump-georgia-grand-jury-recommends/story.aspx?guid={20C06575-04D4-B545-719B-97B4BDD0107D}&siteid=rss
2023-02-16 00:10:00,McDonald's new plant-based menu item: non-chicken McNuggets,foxbusiness.com,https://foxbusiness.com/markets/mcdonalds-new-plant-based-menu-item-non-chicken-mcnuggets
2023-02-16 00:01:00,‘The World’s Largest Construction Site’: The Race Is On to Rebuild Ukraine,www.nytimes.com,https://www.nytimes.com/2023/02/16/business/economy/ukraine-rebuilding.html
2023-02-15 20:02:00,US restrictions on goods from China made with Uyghur forced labor worries Vietnam exporters,foxbusiness.com,https://foxbusiness.com/politics/us-restrictions-goods-china-made-uyghur-forced-labor-worries-vietnam-exporters
2023-02-15 19:40:00,"Australian Unemployment Unexpectedly Jumps to 3.7%, Yields Drop",www.bloomberg.com,https://www.bloomberg.com/news/articles/2023-02-16/australian-unemployment-unexpectedly-jumps-to-3-7-yields-drop?srnd=markets-vp
2023-02-15 19:26:00,Asia Stocks Rise on Bullish Signs From Wall Street: Markets Wrap,www.bloomberg.com,https://www.bloomberg.com/news/articles/2023-02-15/asia-stocks-to-rise-as-wall-street-turns-bullish-markets-wrap
2023-02-15 19:19:00,South Korean banking shares plunge in New York after political push,www.reuters.com,https://www.reuters.com/business/finance/south-korean-banking-shares-plunge-new-york-after-political-push-2023-02-16/
2023-02-15 19:03:00,Japan’s Trade Deficit Smashes Record Amid Global Slowdown,www.bloomberg.com,https://www.bloomberg.com/news/articles/2023-02-16/japan-s-trade-deficit-smashes-record-amid-global-slowdown?srnd=markets-vp
2023-02-15 19:00:00,Auctioneer Phillips Expands in Hong Kong as Art Wins in ‘Unusual’ Times,www.bloomberg.com,https://www.bloomberg.com/news/articles/2023-02-16/auctioneer-phillips-expands-in-hk-as-art-wins-in-unusual-times?srnd=markets-vp
2023-02-15 19:00:00,Goldman Growth Fund Boosts Bets on India as China Interest Cools,www.bloomberg.com,https://www.bloomberg.com/news/articles/2023-02-16/goldman-growth-fund-boosts-bets-on-india-as-china-interest-cools?srnd=markets-vp
2023-02-15 18:42:00,Why New Zealand is no safe haven from the climate crisis,www.cnn.com,https://www.cnn.com/2023/02/15/asia/new-zealand-climate-crisis-gabrielle-intl-hnk/index.html
2023-02-15 18:32:00,"Narcan Is Safe to Sell Over the Counter, Advisers to the F.D.A. Conclude",www.nytimes.com,https://www.nytimes.com/2023/02/15/health/narcan-nalaxone-drug-stores.html
2023-02-15 18:29:00,Take Five: The truth about inflation,www.reuters.com,https://www.reuters.com/business/take-five/global-markets-themes-takealook-2023-02-10/
2023-02-15 18:24:00,"Walmart in Mexico gross margin shrinks, quarterly profit up 12%",www.reuters.com,https://www.reuters.com/business/retail-consumer/walmarts-mexico-unit-posts-nearly-12-jump-q4-net-profit-2023-02-15/
2023-02-15 18:24:00,"Crypto? ‘It’s worthless. It’s no good. It’s crazy. It does nothing but harm and it’s antisocial,’ says Charlie Munger",www.marketwatch.com,https://www.marketwatch.com/story/crypto-its-worthless-its-no-good-its-crazy-it-does-nothing-but-harm-and-its-anti-social-says-charlie-munger-af14f1f0
2023-02-15 18:21:00,"Gucci, Balenciaga struggle amid designer shakeup and ad controversy",foxbusiness.com,https://foxbusiness.com/markets/gucci-balenciaga-struggle-designer-shakeup-ad-controversy
2023-02-15 18:20:00,WallStreetBets Founder Sues Reddit,www.wsj.com,https://www.wsj.com/articles/wallstreetbets-founder-sues-reddit-10fa1168?mod=rss_markets_main
2023-02-15 18:13:00,"Stocks moving in after-hours: Roku, Zillow, Cisco, Shopify",finance.yahoo.com,https://finance.yahoo.com/news/stocks-moving-in-after-hours-roku-zillow-cisco-shopify-225313523.html
2023-02-15 18:13:00,Norfolk Southern train derailment likely to have minimal impact on shareholders,foxbusiness.com,https://foxbusiness.com/markets/norfolk-southern-train-derailment-minimal-impact-on-shareholders
2023-02-15 18:03:00,Crypto Stocks Jump Despite Looming Regulatory Pressure,www.wsj.com,https://www.wsj.com/articles/crypto-stocks-jump-despite-looming-regulatory-pressure-f27b2df7
2023-02-15 17:55:00,Booming oil exports boost US role as global price maker,foxbusiness.com,https://foxbusiness.com/energy/booming-oil-exports-boost-us-role-global-price-maker
2023-02-15 17:48:00,: Nu Skin stock falls 9% after Q4 sales miss,www.marketwatch.com,http://www.marketwatch.com/news/story/nu-skin-stock-falls-9/story.aspx?guid={20C06575-04D4-B545-719A-E4855980ED05}&siteid=rss
